,課程名稱,評價星等,評論數,總影片時長,觀看數,價格,課程簡介,評論標題,評論內容
0,簡單學會入門款 【復古手工書 】,4.86,22,151,347,200,復古手工書X4種樣式,"['教學仔細', '有趣的手工書製作體驗', '很仔細的教學', '跟著做就能完成', '不錯', '棒!棒!棒!', '有溫度的手工書', '入門手工書的好課程', '不错的课程', '我的手工書', '有趣又實用的手作課程～', '動手跟著做就行', '容易理解', '手縫書細心指導', '讚讚', '還不錯~', '課程進度有條理', '不錯', '還不錯', '清楚的手工書教學 很棒喔', '超有成就感', '很可愛又很實用呀']","['教學很仔細, 將手作的細節都拍攝得很清楚. 謝謝!', '老師講解的非常清楚，是一次很棒的動手做體驗，完成作品很開心！', '很仔細的教學\n非常實用', '課程講解的非常詳細，只要跟著做，就能完成自己的手工書~\n', '容易了解', '老師講解得很詳細!非常棒!:)', '謝謝老師清楚的講解手工書製作，選擇不同質感的布和紙，呈現出不同風格的手工書，感覺很有溫度。', '課程教學間單好上手～馬上就做兩本送人了👍', '讲解详细～', '課程的講解非常詳細 只要一步步跟著做一定可以完成', '有趣又實用的手作課程～', '老師將細節都說明很仔細,只要跟著做就可以完成成品,很實用的課程,讓第一次製作就能上手。', '老師的講解容易懂，\n作品完成都會很有成就感。', '按照老師的每個步驟，還有老師提供的其他技巧可以做不同的變化。', '很棒！', '老師講得很好\n如果影片收音能更好就太棒了', '老師講解有條理，每個步驟都很清楚，課程物超所值，謝謝', '不錯', '老師很用心，但可以再更好！', '物超所值的課程', '老師講的很詳細\n第一次就上手(・ω・)ノ\n而且真的超美的w', '空閒時間完成自己的作品心情真的超～好～\n利用Hahow學習真的很方便\n老師的教學也很簡單易瞭\n只能說真的大推啊！']"
1,POP-UP！立體繪本手工書 - 娃娃屋篇,5.0,11,100,203,1200,學生可以做出一本屬於自己的娃娃屋結構立體繪本手工書並學習基本的立體結構設計概念。,"['很棒', '老师专业', '有趣的課程', '很棒', 'POP-UP！立體繪本手工書 - 娃娃屋篇', '立體繪本手工書', '做好立體書真不簡單!', '時間不長，輕鬆又易懂，還能運用在手工卡片上！', '有趣的課', 'POP-UP！立體繪本手工書', '課程內容非常清楚有調理']","['很有趣的課程，簡單易懂又專業，謝謝老師', '谢谢老师非常仔细&专业的教导。', '課程講解的很詳細，照著做就能完成一本立體書，可以減少自己摸索失敗的時間。', '清楚易懂', '細節的部分老師講解得很清楚，手工書的組合方式也有仔細說明，上完課後對於立體手工書的知識有更多的認識。', '第一次看到像這樣的立體書教學\n內容挺仔細，我覺得買這門課值得\n不過在說明中間的線的部分有時候不太清楚是在講哪條\n我覺得可以稍微用動畫來說明會讓人更好理解', '感覺得出來老師挺專業的, 真的是設計插畫相關科系畢業的, 但是看完影片後會建議老師在細節上, 可以講得再清楚些, 還有一些鏡頭可以再拍得更清楚些....還有可以再多講一些不同的紙張材料和顏料媒材做出來的立體卡片書屋, 是否就會不一樣呢? 謝謝', '課程特別，輕鬆又易懂，而且上課時間不算長，能夠在短時間知道立體書、立體卡片的基礎規則，剩下的只要多練習就可以了！\n期待自己的第一本立體書！', '有趣的課, 老師講解的清楚, 想要趕快自己做一個', '很喜歡這樣的手做立體書課程，在練習的過程中也注意到很多之前沒有想過的方法和技巧，且非常有成就感！\n以下是對於觀看課程影片時注意到可以改善的地方：\n1.\u3000在一開始介紹基本結構時，雖然有虛線、實線以及顏色區別，但有時還是會不太清楚老師再提及的是哪一條線，建議還是製做簡報配合動畫的方式做標注，這樣觀看者會比較好理解規則。\n2.\u3000希望影片可以有些BGM，這樣製作過程比較不會顯得沉悶。\n3.\u3000個人覺得有些黏貼或組裝的教學部分可以快轉，這樣影片的節奏會比較好！', '老師將製作手工書從立體原則到黏貼成書，按部就班的從簡單到複雜的解釋的很清楚。']"
2,北歐童話紙雕立體書 - 360 度旋轉木馬篇,0.0,0,127,73,2280,"1. 認識立體書的使用方式
2. 認識立體書的基本構造
3. 設計紙雕插畫
4. 練習刀功技巧
5. 撰寫與改編故事
6. 設計旋轉木馬立體書結構",[],[]
3,做自己的藏書票（新孔版）,5.0,21,60,204,150,"以簡單的製版方式，做出自己的藏書票
並可以以此技巧延伸至做自己的紙品--信封信紙、明信片，甚至手工書","['👍', '有趣的課程', 'Nice', '學到關於藏書票和版畫的知識~~很有趣的手作課程~~', '非常有意思的課程', '很棒', '一門有趣的課', '很有趣的一門課程', 'GOOD', '增廣見聞', '有趣的版畫課程~', '真的很棒的課程', '很有意思', '長知識', '激起沉睡已久的創作魂!', '很新奇有趣：）', '不錯', '不錯', '藏書票', '我覺得滿詳盡的', '喜歡<3']","['讓我認識新東西', '認識到新的事物，很特別。', 'Nice', '高中美術課學過絹印版畫, 弄得千瘡百孔慘不忍睹, 從此對版畫和手作敬而遠之~~黃老師的教學平易近人, 難易適中, 除了學習到另一種容易上手的版畫形式, 心裡更不斷浮起這個想法: 為什麼高中老師教的不是這個呢? 絹印對非科班的高中生也太難了吧!!!還是這種新孔版比較好玩~~', '原本只是對藏書票有興趣，沒想到意外認識了新孔版，也複習一遍版畫簽名的方式。手邊雖然沒有工具，但課程中提到的知識或筆觸技巧也可以應用在其他領域。', '增加知識', '這門課真的挺有趣的，但材料部份能多介紹一點會更好', '材料部分講解的稍微少了一點', 'GOOD', '有趣!', '有趣的版畫課程~\n', '對版畫一直很喜歡，現在可以簡單的製作真的太謝謝老師的教學了!', '多多少少了解到藏書票的實際意義，所以收穫很大。', '覺得有趣所以購買了該課程，沒想到藏書票的設計也這麼具有藝術與歷史。', '在朋友的介紹下有幸知道這個課程並一起報名了，自從復興畢業後大部分創作都進入數位化，很少""動手""製作一些作品，有做過孔版、雕刻板(木板、橡皮版、紙板等)，但還沒嘗試過新孔版，本身很喜歡看書、藏書、創作還有交換，課程當中便覺得躍躍欲試，聽到最後老師分享早期藏書票的交換方式真的很有趣，希望也能和志同道合的人交換彼此對藏書票的熱情與驚喜!', '認識了以前沒機會認識的製程\n覺得很有趣', '不錯', '不錯', '還不錯', '如題，可惜還沒有工具可以實做', '很喜歡老師的圖畫和課程，\n讓我對版畫有新一步的認識～']"
4,印花樂－自製手感印花好禮,4.94,33,132,415,1200,"1. 自己用、或送禮用都很合適的手作印花布品
2. 有其他美術或手作專長的朋友（ex. 刺繡、皮件…等），也可以互相結合，作出更有變化的印花生活布品","['很有趣的課程', '很有趣', '無痛學習！', '很享受的一堂課', '清楚易懂', '按部就班~很適合新手的入門課~', '內容可以再深入一些', '很不錯的印染技巧', '我愛印花樂', '喜歡', '簡單有趣', '很好', '很棒!!!', '實用', '簡單明暸', '很受用❤️', '很好', '課程內容很詳盡', ' 謝謝印花樂', '有趣好玩的課程', '淺顯易懂印花課', '淺顯易懂 有趣的手作課程', '很實用', '教學很清楚', '淺顯易懂的拆解步驟', '解說詳細，活潑有趣的課程', '充滿樂趣又實用的教學課程', '很棒的課程', '簡明扼要，淺顯易懂，非常實用', '我會和我朋友推薦', '方便詳細的線上課程', '有趣', '基礎印花課程']","['課程架構清楚，老師講解清楚：）', '看完都想趕快試試看了', '課程易懂、好上手！雖然還沒有實際動手做，還是推薦給喜歡手作的人！', '在某個優惠的機會下，出於對涓印的好奇而購買課程~\n只想完整地了解原理，手作的動力並不是很高~\n但看完整堂課後，卻出乎意料地享受這個過程~\n就像看著職人完成一件藝術品般，充滿美和手作的精神!\n老師的講解也清楚易懂，一些原理還能觸類旁通~\n對其他領域也有所幫助!\n最後還有印好布巾的使用方法~~\n讓人會想把這些美麗的物品運用在生活之中~\n這是一堂從頭到尾讓人享受的課程!\n\n', '簡易製版，適合新手，附應用教學，讚!!', '老師設計的課程對我這印花新手來說很友善也能好吸收上手，按部就班的介紹孔版印花的知識與製作方法~\n期待趕快把老師開的作業趕快都練習完並交齊，之後能越來越熟練做出更多可愛滿意的作品~', '適合非常非常非常非常初學者的內容\n很多東西都只是點到為止\n建議可以用更多作品範例來講解\n像是示範包布巾的包法時，選用的布料印製與配色都更為複雜\n我反而比較好奇那些複雜形狀又是如何印製上去的\n不過這些卻沒有多做說明，有點可惜.........\n\n', '今次這個課程，設計很不錯。我學過絲印技術，有一點經驗，但也從課程中獲益不少。謝謝。', '小花老師的教學讓人感覺輕鬆活潑，課程內容也容易看懂，對印花絹印有更多的認識了，我要快點來試作囉～', '買了材料跟著一起做\n心情很療癒呀😆', '老師分享的作法簡單有趣,說明的很詳細。', '內容架構清楚，有很多貼心的補充', '很值得的一堂課!!', '是個很實用入門的課程。', '小花老師聲線優美，口條清晰且講課活潑有精神，很順利的看完整個單元。\n內容我覺得還可以再加強一些手作延伸單元，CP值會更高（可惜我沒跟上募資階段', '謝謝小花老師用心的講解！\n老師口條清晰，教學活潑，一些眉角都有提醒我們，真的很棒❤️', '很有趣～老師講解很詳盡', '看完後解開了許多書中的疑問，謝謝你們用心製作的影片，獲益良多❤️', '透過線上學習，認識了另一種創意展現的方式，用看的總是比較親自動手簡單，不過一定會來實際操作的。\n用這個方法也比在線上查找到的版畫技術說明易懂，又可以一直不斷再重複觀看內容，畫面也比閱讀文字更清楚。\n真的是很不錯的課程。\n', '謝謝開課 \n學到了很多~^^', '淺顯易懂印花課', '淺顯易懂 有趣的手作課程～', '老師很用心，細節也都說得很清楚，想了解的東西都有教到', '老師講解得很清楚喔~親切活潑的聲音讓人想一直聽課下去~~然後不知不覺就上完課了!', '影片講解的非常清楚，老師的口條也很清晰，適合給喜歡手作但是不知道從哪裡開始的朋友~', '老師把印花的步驟拆解，而且會提醒大家很多小細節，也很耐心回答各種問題，課程簡單易學又有趣，非常棒的一門課。', '老師的教學影片很用心，步驟很慢，初學者也不用擔心看不懂。完成作品後，充滿了成就感，適合愛手作的學員。', '老師口條清楚，示範簡單易懂，課後也耐心回答同學們的問題，很棒的課程👍🏻', '老師口條清晰，操作示範與說明的速度不疾不徐，內容精彩豐富且實用，很容易了解又饒富趣味，很有收穫的課程。', '很方便實用的課程，最重要的是我任何時間地點都可以反覆收看，可以一直觀看老師示範的動作，整體而言很不錯!!', '小花老師口條很清晰，沒有看字幕也聽得很清楚～', '容易操作，富有樂趣，最後一堂課的包布巾包法示範是意想不到的亮點', '課程內容淺顯易懂\n提醒和注意也很實用～']"
5,藍曬技法 - 初學者的氰版顯影  ,5.0,9,118,191,999,"1.  把自己擁有的照片製成藍曬圖
2.  屬於自己的藍曬小品、明信片，適用於紀念送禮，簡單好上手 
3.  各種應用於書本，手提袋上的藍曬延伸應用物","['很值得學習的好課程', '值得上課', '清晰明瞭', '淺顯易懂', '有趣!!詳細清楚有系統!!', '讓人看完了就想親手試的課程', '滿特別的~', '很清楚', '藍曬技法 - 初學者的氰版顯影']","['課程生動有趣 ，老師解說有條理、很詳細，超讚！！', '講解清晰，有條理，大概藍曬的範圍，基本訊息及應用變化都有提到。', '淺顯易懂', '講得很仔細', '以前有聽聞過藍曬但都沒有去了解它的原理，經過老師詳細清楚有系統的課程，不但明白了原理及操作過程，也有很多實際的分享~\n非常棒且有趣的一堂課~迫不及待有空時趕快來動手操作!!', '一直聽聞藍曬的有趣，卻因以為有複雜的準備而作罷，看完課程不只理解原理，更發現準備材料並不是很困難，看完課程買了才了來試，真的超有趣的！', '真的覺得很神奇~ 奇妙好玩的課程!\n謝謝老師', '老師講解的非常清楚!謝謝!!', '講解清楚  很棒 \n']"
6,台灣手語達人孵化班：聾聽雙師的基礎入門課,4.93,14,380,613,1800,"初學者不要擔心自己沒有基礎，你可以跟著老師一步一步學會：
1.	學會常用手語短句
2.	了解台灣手語文法和華文文法的不同
3.	了解手語分類詞的概念
4.	了解聾人文化與聽人文化的不同
5.	用台灣手語打招呼、認識新朋友
6.	用台灣手語做簡單的自我介紹
7.	能夠用台灣手語談論你的家人
8.	學會台灣手語數字及其相關對話，如年齡、價格
9.	用台灣手語講述時間概念
10.	用台灣手語和朋友約定時間
11.	用台灣手語描述金錢
12.	用台灣手語購物
13.	簡單用台灣手語表達自己的意願與喜好

進階者可以更精進，若已經會手語，建議上課時，可以把聲音關掉，也不依賴字幕，直接觀看講師的手語，相信也是收穫滿滿，你將可以：
1.	直接體驗手語教父顧爸的課堂魅力
2.	觀摩課程中的手語活動設計
3.	觀摩課程中的教學方法
4.	利用無聲的課程，精進自己的台灣手語能力","['真是非常棒的課程,希望未來能再繼續開設更多更精進的台灣手語課程.', '手語很有趣課程', '手語學習棒', '很生活化的手語', '輕鬆學手語', '很棒。', '👍👍👍', '輕鬆愉快的手語課程', '🌟🌟🌟🌟🌟', '豐富生動的課程', '很棒的手語課程', '五顆星 ', '很受用', '手語課程']","['上了顧爸父子這麼棒的課程,讓我在學習手語的路上更加精進,真是非常非常的感動和感謝.', '很棒的經驗學習,更多培養手語遊戲好玩挑戰', '課程設計很有趣，有充分練習，受益良多。', '覺得學手語很有趣，會努力學下去，也希望大家都能懂一些手語。', '解說的很清楚,使人明白。\n對初學者來說是ㄧ個很好的統整課程淺顯易懂,還有考題練習對我很有幫助。\n希望能再開進階課程,更上一層樓^^\n', '對初學有幾個月時間的我來說，是ㄧ個很好的統整課程，又幫助我把ㄧ些模糊的部份弄清楚了。。讓我的手語原本會卡住的地方順暢了一些。', '數位化的課程設計，我很喜歡。提出的問題也得到清楚的解釋，非常感謝！\n另外，有一個小小的建議，在應用句的地方，如果手語句不要同時出現，就可以自己先想一想怎麼打。', '手語教學內容淺顯易懂，顧爸比手語的速度表情看的非常清楚！\n教學的內容也十分有系統，跟著打跟著複習，一瞬間就記得很多手語詞彙\n真的非常感謝有線上手語課，讓我可以隨時隨地練習手語\n也期待未來有進階手語課！', '敲碗下一期的進階課程😉\n\n基礎入門課非常淺顯易懂，只要認真上課，不用死記硬背就可以內化。\n\n跟著 native signer學手語就是不一樣，非常有系統有邏輯有規劃的一系列課程，希望聾人文化及台灣手語能完整的保留並且正確的傳承下去，而不是現在被改得亂七八糟的文字手語。\n\n謝謝手族文化村的用心，開這個台灣手語課程❤️\n\n', '課程內容有系統，顧爸手語教學的手勢、來源及手語示範、表情等，非常清楚，我很喜歡！\n手語文化則是非常重要的一環，可以讓我們更認識聾朋友，知道如何正確的相處，受益良多！', '有結構性\n表達清楚\n方便學習', '那是像手語教學是準僃活動、發展活動、統合活動嗎??', '講師很用心，更了解聾人文化。', '在網上有無法進入上課影片,你們很快處理問題,非常棒~謝謝']"
7,寫一手西洋書法美字：銅版體習字課,5.0,8,354,420,2000,"能寫出架構正確、連接法正確的銅版體，避免初學者常見錯誤。
能寫出不同變化的銅版體美字。
了解基本的 Flourishing（花飾）規則。
創作屬於自己的簽名。
了解卡片的創作規則，並能畫出賀卡。
利用銅版體製作禮品包裝紙、禮物、長夾等等。","['物超所值的課', '驚喜', '淺顯易懂', '跟著練習美字不是夢想！', '配合時間', '依照自己的進度慢慢學', '書法新手必學！', '內容豐富']","['平時有在關注花體字相關的影片，很幸運能夠在這邊遇到老師的線上課程，能夠自己安排上課時間以及進度相當不錯，課程內容豐富而且老師的說明很清楚，認真練習的成果非常有成就感，期待老師新的課程~', '超棒的，很詳細解說，絕不是自己看書傻傻練能比擬～畢竟寫字要好看，內化的施力運筆很難僅僅用文字敘述的完整。老師一筆一劃邊講解，觀念對了事半功倍，剩下的就是好好練習了～', '老師說明淺顯易懂，示範書寫若能再多一點會更完美', '跟隨老師的專業指導，一步一步練習，線上課程更可自己掌控練習的進度，好好學習每一環節，不時回來複習，相信不久也能寫出美麗的字。謝謝老師！', '線上課程最方便的是可以自己調整自己的上課時間！有不懂的地方可以重複的看！\n而且在新冠肺炎疫情嚴重的情況，在家不出門也是可以學習到課程！非常方便', '線上課程很彈性也方便，可以依照自己的進度慢慢學、慢慢練習，必要時還可以回頭複習不熟悉的筆觸。', '老師非常詳盡及清晰拆解每個字母及數字的結構，對初學者非常實用，照著老師的指示練習，寫出來的字有明顯進步！也能掌握基本畫花線的技巧，練習時才不會覺得沉悶。\n希望老師再開其他課，例如設計花線、 modern calligraphy等', '內容豐富']"
