,課程名稱,評價星等,評論數,總影片時長,觀看數,價格,課程簡介,評論標題,評論內容
35,卡片筆記術：高效內容產出的秘密,4.66,35,125,773,1900,"・架構出一套有「複利效益」的卡片筆記術，有系統地整理多元資料
・組織一套非線性、可靈活組織的筆記系統，協助你聯想、比較多方觀點
・在龐大的資料中轉化、重組筆記，萃取有助內容發展的論點
・增加寫作創作或商業提案內容產出的效率，讓內容創造價值","['簡單易懂', '原來作筆記這麼簡單', '我的老天鵝啊~原來上課可以這麼有趣!', '很棒的課程', '生動活潑的教學', '卡片筆記術：高效產出的秘密', '卡片筆記', '希望能在各平台的使用說明的更詳盡', '有點失望', '工具的介紹與說明很方便', '腦袋的想法得以實踐', '建議看書了解核心觀念', '簡單易懂，生動有趣', '簡潔易懂', '新手必學！這堂課是熟悉卡片盒筆記法的第一塊「敲門磚」', '整體還算滿清楚', '很高兴自己选择了这门课', 'Good!!', '讚讚', '優質有深度的課程', '很棒的一門課，也很輕鬆的狀態就學會了卡片盒筆記', '看不懂', '淺顯易懂', '好課程!!', '淺顯易懂', '打不開影片', '超值的一堂課', '大幅縮短了卡片盒筆記法的上手時間與效率', '淺顯易懂的教學', '五顆星', '超乎期待的課程，值得一再回味。', '精彩的課程, 迫不及待想看到接下來的章節', '老師教法深入淺出', '卡片盒筆記術評價', '打不开视频。']","['非常適合作為卡片盒筆記初入門的解說課程~\n先把所有課程看完之後，再來一步一步思考自己的Notion、格誌要如何建立也是很好的~', '這是我第一次在好學校購買的課程，試看之後覺得很有趣，會繼續看下去的課程，於是就購入了\n2天內看完課程，覺得這堂課很有趣，也有一些動畫讓我更好理解什麼是卡片筆記。\n感謝永錫老師 跟 課程團隊的努力，可以將這麼複雜的卡片筆記，用非常容易理解的方式錄製影片。\n覺得受益良多~', '記下來、能秒懂、有關聯\n張永錫老師透過生動有趣的演繹，帶領著學員展開輕鬆的學習!\n不同以往傳統單向授課、一對多的教學方式，而是透過類戲劇與輔助道具的活潑教學，讓""卡片筆記術""以輕鬆有趣的方式呈現，課程中老師歸納出簡單的筆記術重點，讓""筆記”變得更靈活，而不是只是單純的紀錄!', '內容有用故事和短劇來說明，教學生動活潑，可以讓幫助學習很容易進入狀況，因為之前沒接觸這樣的主題，所以我自己也需要多加練習，課程很有深度，我還蠻喜歡的 XD', '1.每個影片時長很恰當，適合時間被切割的現代人。\n2.某些卡片(盒)的運用方式及介紹太少(例如文獻、主題索引)，聽完後腦袋只剩下「要記得將靈感筆記轉換成永久筆記」、「筆記之間透過數位工具達到適當的連結」，但我相信老師想表達的訊息應該不只是這樣，可能是我自己尚未完全理解。\n3.雖然老師有提供notion的模板，但想像老師教學格誌日記的模板建設那般，請老師教我們整個模板製作的邏輯及過程。\n4.很喜歡最後一個單元說明了整部教學影片的架構，這樣再重看一次時能更抓得到重點。', '1、老師講話風趣，那位小幫手演員演的超級好。\n2、針對靈感筆記那邊，如果可以多著墨一些會更能理解，只知格誌日記，但是不太知道如何應用整合到永久筆記\n3、每堂課的時間剛剛好，聽完不會太吃力', '利用卡片筆記方法有系統做筆記', '希望能在各平台的使用說明的更詳盡\n特別是notion的部分是最重要的卡片部分\n但如何更完善的製作卡片\n希望有更詳盡的範例與說明', '可以理解老師希望以戲劇的方式比較有趣呈現，但覺得反而有點怪。\n同時本來希望有更細節的講解每一個永久，文獻，靈感筆記，但範例就只有一句話', '持續記筆記不是件容易的事情，但透過模板的介紹，可以想像知識庫越來越充足的成就感\n在工具上與卡片觀念上的簡單說明，都很方便理解和操作。', '在老師一步一步的帶領下，很明確的學習到如何將一個個想法化為實際可使用的訊息。\n並可以互相連結🔗。謝謝老師啦😀', '學了很多數位工具，卻搞不清楚如何整合運用，編劇很用心製作各式情境模擬，但卻壓縮工具應用解釋時間，建議找原書來看。', '內容十分簡單易懂，且生動有趣，讓人很容易理解卡片盒筆記術，且知道如何去執行。這還是我第一次看線上課程沒看到睡著的...', '老師把很複雜的概念簡化，更容易消化。剩下的就是自己實際操作練習，很期待卡片筆記會如何優化我的workflow.', '其實卡片盒筆記法雖然將寫作的方式大幅度的簡化，但是真的有在實做的人都知道要運用自如仍需要「大量的刻意練習」後才能心領神會。我很驚艷張永錫老師居然可以將卡片盒筆記術大幅降低學習門檻到如此的程度，輔以大量生動的遊戲與實體物的解說讓人「秒懂」。因為通常看完卡片盒筆記法這本書的人到實作還有一段距離，而永錫老師的這堂課可將卡片盒筆記法快速的「接地氣」，讓人可以以很簡單的方式快速實作。\n\n非常推薦給剛開始想學習卡片盒筆記法的人喔！而如果覺得上完這堂課意猶未盡的，永錫老師也有開設Youtube 頻道幫助想持續進修的人喔。https://www.youtube.com/user/twhsi', '1.書裡的推薦序其實不推薦notion，和講師介紹的軟體滿意外的，或許還是要再找找更適合的軟體\n2.整體的教學內容還不錯，搭配的案例及前言引導讓整門課程很有吸引力\n3.最後兩節有點弱...不像前面的內容很精彩，我覺得比較可惜', '感谢这门课，让我学习了卡片笔记术。学会如何吸收知识，如何整理资料，如何建构自己的知识体系，以及如何输出内容。\n课程设计轻松好吸收，是学习卡片笔记术的很好的入门课。\n结合数字工具的介绍和操作，配合课后的练习，上完就可以开始建立自己的卡片笔记盒。 ', '卡片筆記內容概念講解清楚\n也搭配多種App協助記筆記\nNotion的部份希望能再多一點\n例如實際新增1、2個新的永久和文獻筆記，再去做連結的過程。', '永錫老師的課程真的很棒!', '課程內容設計用心,讓不習慣卡片筆記的我有初步的概念,讓我也想跟隨老師的腳步試著將腦中的想法記下來,以利將來做更好的運用.', '淺顯易懂、每堂課又都很有吸引力，會讓人一堂接著一堂的上，不知不覺就上完課了。', '沒慧根吧…看了一半都沒懂……', '老師教授了許多卡片筆記術的基本觀念，運用生動的故事與舉例，讓我們對卡片筆記有完整的概念。只是實際在操作永久筆記的時候，對於索引標籤的建立較無方向，如同老師所說，索引能夠讓這些筆記產生連結，是不可或缺的重要元素，可是課程裡較少對這段實作有詳細的講解，當然可能礙於課程時長的關係，無法面面俱到，所以如果可以的話，希望老師能以其他可行方式（留言回覆或其他）說明索引標籤的建立方向。謝謝老師！', '內容豐富多元、淺顯易懂（有看過卡片筆記術的書籍，老師真的把那些很難的東西用很簡單的方式交給大家），可以搭配實際狀況使用，如果過程有產生任何問題，都可以詢問老師，老師都會很親切的回應！', '現在講究精準學習，不一定要把書本從頭到尾看完，只要看重點即可，這門課老師所教授的都是卡片筆記的精華，讓我們在學習上更無往不利。謝謝永錫老師', '2-3之後的影片記錄全都打不開', '永錫老師上課很生動有趣，讓人上癮的一集一集看下去，重點是還可以學到要如何架構出我們真正可以用的卡片筆記術系統。\n期待新集數可以早日上! 另外想知道用關聯可以直接取代索引嗎? 還是索引有什麼不可取代性?', '比起閱讀「卡片盒筆記」書籍要用掉8個小時的時間，線上課程縮減了理論的闡述(說服)，聚焦在如何開始上手開始建立有用的筆記系統，用更短的時間就可以上手，也提供最新的電腦與手機應用程式APP的建議與範例，讓我更有效率地建立起自己的數位卡片盒筆記系統', '一口氣看完淺顯易懂的教學，只可惜未能一次釋出所有課程，讓人等待，總是......。\n\n不過第一次接觸到課程介紹的「格誌」APP，還蠻好上手的。接下來，就看能否好好使用它了！', '簡單，易懂，好上手的課程。', '看完卡片筆記盒這本書配合老師獨到的演繹及講解，收穫良多。期待剩下章節能有獨到洞見讓人驚艷。', '從腦內紊亂的思考靈感, 落實到有效的資料管理運用, 真是一門很大的學問.....\n光整理出邏輯已不簡單...更何況老師以如此精彩的方式變成清楚教案...\n佩服  \n感謝老師解決我長年遇到的問題', '老師把卡片筆記概念說的很清楚，謝謝老師', '對於永錫老師的卡片盒筆記術課程感到非常滿意，個人認為卡片盒筆記術不只適用於內容創作者，對於設計師、藝術家等需要發展創意與構想的職業也十分合適，是非常優質的學習工具兼創作工具，大家都知道設計師需要不斷的學習，從社會、書籍、生活提取出不同的靈感，然後根據條件與需求創作作品，但是往往在學校會發現，最努力做案例分析的同學，還是會輸給擁有美感天賦的學生，而卡片筆記就是將那些努力做案例分析的學生，讓他們的努力發揮最大值的一項工具，我相信藉由卡片筆記能夠讓更多創作者創作出既合理又完善的作品。', '打不视频。']"
36,實作「冬季甜點首部曲」DESSERT - WILLIAMS SONOMA,4.5,6,121,121,600,"蘭姆巧克力蛋糕Flourless Chocolate Torte、起司蛋糕Cheese Cake、舒芙蕾Grand Marnier Souffle、水果奶醬塔Fruit Tart

📍 特別提醒：此堂課程沒有附贈食譜檔案，老師將以影片呈現配方表","['高CP值的甜點課', '新知識', '蘭姆酒巧克力蛋糕', '建議有基礎的同學來上這堂課', '冬季甜點', 'practical and clear illustration']","['老師的授課講解仔細~也會不斷地貼心提醒小細節', '課程大綱不錯', '好好吃😋作法真的不難耶！一開始找不到配方克數有點失望，但很快的hahow團隊立馬幫我截圖附上，真心超感謝讓我真的品嘗到可口美味有附層次的蛋糕🍰', '這堂課多以實務操作為主，無法講解到細節，建議有基礎的同學來上這堂課，比較知道老師在課程中講解的一些手法想要表達的概念，當作再次進修。', '之前很想學此類的甜點製作\n終於有可以讓我有興趣的課程了\n雖然製作繁雜\n但是為了吃到好吃美味的甜品\n不管如何都值得', 'good']"
37,柳川や的菠蘿祕密，在家做 14 款排隊麵包！,4.88,33,546,1975,3500,"1.	艾力克帶你從攪拌、發酵、整形到烘烤，完美做出柳川や 14 款超人氣麵包。
2.	學會星野酵母培養方式與邏輯，其中還包含赤生種、赤魯邦、隔夜液種及牛奶種。
3.	解說烘焙的基本工序，提醒每一個環節的重要細節，新手不怕學不會。
4.	講解「長時間低溫發酵法」的模式，減少製作當天發酵時間。","['期待的課程', '課程簡單易懂', '清晰明瞭的麵包課', '超推薦', '非常棒的線上課程', '值得擁有的線上課程', '評價課程', '超值課程', '五顆星好評', '很棒！', '課程講解清楚，流程安排順暢', '把困難的內容跟操作手法教的很簡單', '課程很好。但希望可以改變一下拍攝背景和多點close up', '超值課程', '很棒的一堂課', '好吃的排隊麵包', '非常值得的課程', '配方好吃做法簡單', '很棒又實用的内容，大推薦！', ' 收穫滿滿 添購器具想要開始做麵包了', '很棒的線上課程', '很棒的課程', '超級棒的線上課', '超值的課程', '最棒的網上課程，謝謝老師。', '很值得购买的一个课程', '真的很值得', '講解仔細 大大推薦', '評價', '內容豐富又實用', '非常實用的課程', '課程評價', '很棒的課程']","['有看了一些片段，有時間會馬上來試試', '比較難處理的丹麥麵包和國王派，老師用淺顯易懂的方式教學，很適合新手。\n同樣的餡料可以運用在不同麵包上面，真的很實用。\n只是鏡頭的角度就固定那幾個，有些畫面有特寫會更好。', '上過老師實體課程進而購買線上課程，非常喜歡老師的教學方式，說明的很清楚，讓初學者也能淺顯易懂，基本設備也能在家做出好商品，很喜歡線上百看不厭的學習方式。', '全職媽媽上課進度像烏龜，但還是迫不及待先給評價。\n超推薦這位老師及這門線上課程，疫情之前我上過不少老師的實體課程，但每次都有聽沒有懂，有的給錄影、有的不給，筆記寫滿一大堆，回家還是不會做。\n\n本來很擔心線上課程沒有實際做的話，一定不會做，但老師講的好詳細，上課輕鬆又幽默卻不失專業。\n\n總之這是唯一一位我目前上課後，最推薦的一位！', '老師的教學清楚，配方好吃，又容易上手，物超所值的線上課程。', '這課程不單止讓新手容易上手，就算有烘焙基礎的人，一樣獲益良多。需然線上課程沒有互動和即場發問的機會，老師卻能明瞭學生在運作上的問題和解決意想不到的盲點，老師的經驗和洞察力真的一級棒👍👍\n老師把複雜的烘焙知識，用輕攪笑的形式帶出，令人感到做麵包是一件快樂事，而且秉承好吃、好做、好生產！絕對是超值的線上課程！', '上課的內容將解仔細，老師對於麵包的口感和做法清楚講解，讓沒上過實體課程的我也能做出像外面賣的麵包，非常推薦新手們來參與這堂課程', '老師講解非常清楚\n有sop流程步驟\n超值的課程\n有機會一定要去參加老師的實體課', '試做了肉桂捲非常好吃也很容易操作\n謝謝老師分享', '老師敘述詳細，重點會一再重複提醒學生，講述親切，很值得的一堂課程，大推！', '老師的課程講解清楚，流程安排順暢，所教導的麵包也都是大眾所喜歡，接受度高的產品，課程中老師有教學使用液種酵母替代星野酵母，不用擔心酵母不易購買和保存，老師上課的風格很風趣，不會因為是線上課程缺乏實體互動讓人想睡覺，上完課後會覺得做麵包並沒有想像中的複雜和困難，是對麵包新手很友善的課程，麵包做出來真的很好吃。', '老師把以往看似困難的操作手法講解說明的很簡單，有新手模式也會示範高手模式，把烘焙變得很簡易有趣，很想快點動手嘗試一，重點是，看老師吃也覺得很想吃吃看。', '老師的講解十分仔細，教學用心。分享了很多tips!\n\n如果改換一下拍攝背景，和多一點面團close up會更好。在白色table放上淡白色面團示範 (例如鹽可頌）。。。。真係很難看到麵團的造型變化和手勢。感覺有點浪費了整個課程。亦要很費神觀看，感覺像是在做視力測試。。。。', '一直以來都是hahow的學員，在偶然下買了老師的課程，真的很開心。老師上課的口吻十分的風趣，且教學方式非常的淺顯易懂，課程拍攝的畫面也將操作的手法拍得非常清楚，是一堂非常適合初學者的課程。', '課程內容很棒,老師講解清楚,偶爾帶點俏皮的玩笑,不會無趣想睡覺.\n但缺點是拍攝視角略顯單調,視角大都採用平視或上往下二個視角\n一直是這樣的視角讓人以為是在看監視器\n只有少數幾個鏡頭老師拉麵糰時是近距特寫.\n老師搓水滴,捲起鹽可頌,拿起說看側面的厚薄時,視角也是上往下遠視角,沒有特寫鏡頭\n新手根本看不出來所謂的厚是多厚,所謂的薄是多薄.不懂\n老師切開國王派時,拿起來說看層次,結果又是上往下的遠視角\n仍沒有特寫鏡頭,所謂的層次是看哪裡?怎麼看?不瞭\n不知是攝影組只有二個鏡頭的問題還是剪輯組剪掉特寫的問題,\n我是用電腦看影片的覺得沒特寫眼睛看得很辛苦,\n那些用平板,用手機看影片的人,眼睛不就更辛苦=_=\n這是殘念\n三顆星是給老師的,扣二顆是視角單調問題', '謝謝老師無私的教導,讓我學習好多種麵包製作,每款都是經典麵包,期待老師新課程.', '每個單元都很用心的說明與提醒\n講義部分也註記的非常清楚\n非常值得推薦的課程\n', '很實用的一堂課，配方好吃做法簡單，在家能容易上手。', '老師上課內容很豐富，從材料的選擇，操作步驟，到完成品，老師很用心的提醒很多小細節。 講解內容用的比喻都很有趣，口條清楚節奏抓得剛剛好。上起網課來一點也不枯燥！ ', '做烘培已經五年了，從來沒有花錢上過課，這次看到老師的課程，想起以前做的波蘿麵包都不怎麼好吃，為了波蘿麵包就下手了這個課程，上完課之後真的是收穫滿滿，很多以前不會注意到的小細節，跟不知道原因的失敗，現在都獲得完整的解答，真的是很優質的課程。', '最近半年上了幾堂線上課程，這一堂是我上過最棒的，除了不拖泥帶水，一次給你所有的課程，讓你自己挑選有興趣的，安排上的先後順序外，老師清楚而且不藏私的教學，尤其讓人激賞。希望老師能有更多的作品分享。', '這是一個值得被推薦的課程，是我買過烘焙課程中 ，可以感受到老師用心教學，以及有耐心的解答學生的問題，可以有耐心回答每個學生所提出的問題，對烘焙新手而言很重要⋯期待老師再開課⋯', '老師的講解非常詳細，麵包小白也能順利完成，星野酵母一試難忘，已經回不去了，期待老師更多的線上課', '教學內容,講義教材,甚至各種問題回覆都非常詳細,每樣產品也都非常經典,真得很棒,很想給十顆星.謝謝老師\n', '課程內容的解說，簡單明瞭，清清楚楚，比較我買的其他幾個課程，這個最棒，實在物超所值，課程上的很過癮，謝謝老師無私分享。這可不是廣告，是我課後感言，一定要讚美鼓勵一下好老師。', '老师教导得很详细，食谱上的面包我做了两款都很好吃，家人都很喜欢。\n老师很幽默，非常喜欢这课程。', '有買過很多其他課程但發現這個課程每個都很經典，當初只想看看菠蘿麵包與蔥麵包製作瞭解參考，沒想到每一個課程內容老師都不厭其煩的教導非常多知識與手法，真的讓我們這些會做麵包的新手可以有效突破，這課程太棒了很值得！我買了很多課程第一次留言評分，就代表這個真的厲害，也謝謝老師師傅可以不藏私的教導，真的很棒！', '艾力克老師的風格輕鬆幽默 又充滿專業知識 學習到很多\n尤其冷藏法對全職媽媽製作時間的安排更自在更彈性\n非常推薦給大家這門好吃好做好生產的線上麵包課程', '講解詳細  除了家用課程以外 還附帶說明了專業手法  以達到生產效率', '感謝老師詳盡的教學內容，實在獲益良多！', '之前就參加過老師在實體教室開的課，這次能參加線上課程真是太好了。不熟的地方就一直反覆觀看以及練習。', '清楚易懂的講解，風趣幽默的口吻，值回票價的課程，老師真是太棒了！', '學到培養星野酵母的方式，各種麵包製作方式']"
38,萬用馭髮術全攻略 - 女神髮型養成班,4.75,4,116,173,1299,"．學會後未來購買髮型工具更有概念，不會隨意買到不適合自己又浪費錢的產品。
．學會將頭髮吹柔順，並做出長髮大波浪捲、中長髮浪漫捲以及短髮空氣捲等不同捲度，並打造適合自己的瀏海。
．每堂課講解不同長度適合的編髮，不論短、中、長髮，皆可找到屬於自己的編髮髮型。
．了解不同場合適合搭配的髮型；如何養髮才能打造出好髮質；不同髮色在拍照時的效果，以及髮色該如何搭配妝容顏色才恰當。","['头发的护理,技巧和怎样挑选颜色', 'ok', '相見恨晚的課程', '淺顯易懂']","['老师好, 大家好,\n我觉得在这课程可以让我更了解到怎样使用卷发棒和负离子的技巧和怎样挑选发色让自己看了有健康的肤色和怎样保护头发避免容易受到伤害.\n老师教得很棒, 如果还有开课我一定会在报名. 谢谢.', '課程內容不錯', '老師講解很仔細，很適合每一位女孩們學習，非常實用的課程！', '老師備課很用心，講解清楚易懂，很適合手殘又想把頭髮打理好的人。非常推薦！']"
