,課程名稱,評價星等,評論數,總影片時長,觀看數,價格,課程簡介,評論標題,評論內容
24,火頭工做麵包：用科學方法學做健康麵包,4.92,90,188,1296,2600,"1.	了解麵包的材料和製作工序。
2.	縮短初學者探索的時間，同時降低材料耗費的成本。
3.	深入理解麵包的科學原理，在製作麵包時，更能得心應手。
4.	學會六種具代表性的麵包：雜糧、土司、鹽可頌、布里歐、裸麥、小餐包。
5.	如何設立微型社區烘焙店的經驗分享。","['非常受用的課程', '很實用的課程', '講解清楚', '值得一看再看', '火頭工做麵包', '可愛的師傅教學，一口氣就看完了', '講解清晰', '與酵母共舞', '了解製作麵包的相關知識', '課程說明容易理解', '很實用的一堂課', '值得上的一个课程', '值得一上的課程', '推薦🥰🥰🥰', '很棒的課程,理論與實務並重', '很扎實認真的課程', '謝謝老師', '內容豐富', '初學者適合', '火頭工作麵包', '很好的課程', '課程清晰實用', '學習不同的麵包做法', '值得推薦的好課', '簡單原理到實際操作都有的扎實課程', '簡單卻非常豐富的課程', '教學非常詳細', '實用課程', '超值的課程！', '很實用的課程', '火工頭做麵包評價', '不只給初學者魚竿,還教會我們如何釣很多魚', '火頭工做麵包，火頭工經驗豐富。', '很實用的課程', '心得', '條理清楚又易懂', '超值的新手課程', '喜歡科學做麵包', '不一般的麵包課', '有內涵的麵包製作課程', '用心且實用的課程', '受益菲淺', '很棒的課程', '课程内容', '五顆星', '很喜歡這堂課', '受益良多', '不讓遲來的衝動曇花一現', '老師講解得很詳細.', '超棒課程', '非常實用的課程', '很實用的課程', '超讚的烘焙課程', '非常實用', '實用內容', '深入淺出的介紹獲益良多~', '健康麵包', '非常實用的烘焙入門課程', '期待高階課程能開課', '實用的麵包課', '簡單實用的麵包課', '透過課程說明更清楚了', '用心做個健康的麵包', '謝謝經驗分享', '很仔細', '內容豐富做法簡單', '收獲很多', '受益良多', '基礎課程講解清楚', '用火頭工的做法可達專業等級', '感謝老師無私的分享', '非常適合想學烘焙的同好', '首次嚐試線上學習', '基礎課程講解的很清楚', '最天然、最健康美味的手作麵包', '課程適合有點基楚的人，解說詳細', '超級開心實用的課程', '六星級的課程', '健康麵包是手作烘焙的最高追求', '謝謝老師詳細的內容課程', '很適合新手當入門課程', '酵母和麵粉的特性和用法更進一步的了解', '上完課程獲益良多', '實在溫暖', '收穫很多', 'cp值很高的課程', '單元二', '好課程、好老師、好觀唸', '希望更務實一點', '對於想做健康麵包的人來說，這是值得學習的好課程。']","['老師教了許多基本麵包作法，很受用的課程😃', '條理分明清晰易懂，讚！', '老師的講解清楚易懂，很實用', '老師講解詳細、實用。\n', 'Good!)', '起種中，期待完成好吃的作業', '因為野生酵母的魅力而決定開始學做麵包，中間歷經了幾次失敗還有少數的成功，\n摸索了一陣子，決定購買這堂課，把一些基本觀念弄清楚，\n(因為不想一直浪費材料跟時間苦苦等待野生酵母發酵，但是烘出來結果可能不盡理想)\n老師的講解清晰明瞭，製作的麵包樸實美觀，並不講求奇特、絢麗的造型，\n我喜歡這樣的麵包，樸素、對食材的尊重以及想要與家人分享的那份心意。\n\n選購課程可加入FB社團，看見老師會給有實作的同學們一些鼓勵跟建議，\n更可貴的是老師有時會用另一種觀點來分析同學的成品，\n而不是單純以外觀如何來解析。\n之後希望繼續上另一堂老師開的課，開始自在做麵包，跟家人分享~\n', '課程架構紮實、內容設計非常的豐富，也用最專業的詳細講解，讓我每一堂課都有收穫。非常推薦喜歡做烘培的朋友也一起來學習。', '了解製作麵包的相關知識，甚至可以賣麵包賺錢', '老師用容易理解的說法，解釋一些需要了解理論，對於初學者也可以很好上手。\n揉製麵團的手法，有分初階和進階版，也很實用。', '課程內容深入淺出相當實用,連我這個麵包新手都能簡單操作,,而且也很好吃.謝謝老師', '非常detailed and easy to understand!', '課程講解詳細，對初學者來說，有這麼一套淺顯易懂卻非常扎實的課程，真是太幸運了！', '課程內容清楚明瞭～很棒的是可以重複觀看 對於新手真的很受用🥳🥳🥳', '很棒的課程,理論與實務並重,從課程中學到了很多.', '看似簡單的原料 在老師仔細的教學下 變成溫暖好吃的麵包 是個值得一看再看的教學影片', '很棒 懂了更多', '內容很豐富，切入角度很獨特，學到一些麵團發酵背後的原理，更科學的理解怎樣製作和改善作品。但對攪拌完成的筋度如何判斷，怎樣影響後續步驟和成品，希望可以增加影片解說。', '跟著老師一起做，如果不懂可以留言詢問', '課程由淺入深、講解詳細、是門初學者很適合的課程', '老師很用心', '課程從基礎教起，說理讓人易懂，是個學做麵包的好課程。', '老師很認真的設計了各種不同代表性的麵包，可以一次學到多種的不同類似的麵包，真的是超級值得。', '講解詳細，很多理論更能了解為什麼有時候做不成功', '謝謝老師編纂如此詳盡的課程內容。用詞淺白易懂，適合初學者或是有過一些烘培經驗但不是很了解操作步驟原因的人。', '就像老師說「簡單而豐富的麵包」一樣，這是一堂簡單而豐富的課程，除了認識做麵包的基礎知識，更棒的是傳達社區型麵包店的理念，希望自己也能朝這個方向邁進！\n謝謝老師的教學！', '以前在學校或坊間的老師傅都說不出原理，只能跟著做，學習上很困難，經過火頭工的課程終於能釐清概念，當然還是要實際操作，才會融入所學。', '不只是基礎還學到健康的麵包，也讓我以前想不通的點也通了，謝謝老師這實用的課程 ！！', '內容解釋的很詳細，從理論到實做，老師都很深入的講解。跟著步驟實際操作，可以慢慢領悟及突破之前做麵包時的盲點，每個作業品項，老師及團隊也都很認真回覆，真心覺得這是個超值的課程', '從基礎到實作，老師講得很詳細，我收穫很多，謝謝。', '從老師的解說中，更清楚了解做麵包的概念，一步一步地做就能成功', '白話,有條理的科學論述,\n初學者能很快地建立清楚的概念後\n透過實踐印證所習得的知識,\n並將內化的知識發展出自己的思維架構\n創造出屬於自己的獨特風味麵包的幸福感\n甚至讓這種幸福延伸到更多 更遠的地方\n真的好棒!', '火頭工做麵包，火頭工經驗豐富，感謝經驗分享，烘焙是要自己多練習才算真正學到，而且要不斷修正，希望火頭工繼續不吝賜教！', '講解很細，以前麵包店師父都不會教這麼仔細😅', '新手入門不錯的課程', '很喜歡老師的教學，說明非常清楚且有解說進行各個步驟的原因，也實際做出了好吃的麵包，非常開心，期待之後的課程！', '非常適合初學者購買，很多細節都解說清楚，但字幕會擋住老師手中的麵團，有點美中不足。', '做麵包不是光靠食譜就可以百分百製成功\n很多細節、環境…各種條件造就不同的烤培結果\n這也是迷人之處，得以一直精進\n\n此課很深入的說明必要條件、次要條件\n讓很多原本模糊的觀點瞬間清朗\n非常棒，也慶幸自己選譯此課程，獲益良多', '很喜歡老師每堂課的重點總結，注意到這些以往容易被忽略的小細節，讓成品更進步了一些。', '相當不錯的麵包課程內容， 此為基礎課程，第三單元倒是不是每個初學者需要，倒可多增加整型手法技巧，仍有許多問題不清楚， 問題回覆有點慢，除此之外，我覺得相當不錯的課程', '講解深入淺出，內容精確而實用，為初學者點出一盞明燈。', '上課內容兼顧傳統與健康，除學習麵包製作，更能得知社區麵包店開店知識，期待老師開高階的課程', '可以學到健康又是我喜歡吃的麵包，家人也很喜歡吃我做的麵包，做健康的麵包是非常開心的，謝謝老師詳細的解說以及詳細的講義，使我很容易上手。', '老师很用心讲解\n课程内容很务实，让我对面包制作更多一层了解\n课程与笔记都非常详细', '內容基礎但解說詳細，希望還能開更進階的課程', '解說詳細，可以從課程跟 Q&A 中學到很多，期待之後可以有更多相關課程', '很棒的課程，老師講解得很清楚，有遇到問題也解答得很詳細，非常期待有更進階的課程。🤩', '知所以也能知所以然，是有效縮短探索時間的好方法。對照課程內容、老師的提示，實作時能比較從容一點。\n做得不理想，再看一遍課程，總會發現一些執行時的輕忽，一邊修正一邊嘗試，更能體驗做麵包的樂趣！非常讚！', '老師講解得很詳細,也將自己的經驗分享給學員,內容適合入門初學者', '細節講的很清楚，加上示範，還有很棒的講義，真的解開我很多做麵包失敗或不懂的疑問！很推薦！', '老師講解很仔細，完成課堂還可以自己實習給老師評分，有問題又可以請老師解答，非常推薦！', '課程裡的做法詳細清楚，成功率高，讓人會想再學習更多麵包相關的知道及製作技巧°', '老師講解非常詳細\n而且能不斷重複回看\n真的是超讚的線上課程\n謝謝老師期待老師的進階課程', '簡單無添加傳達好的食材作好的麵包的職人精神，麵包如何分辨攪打程度還是一個靠經驗的過程，只有不斷練習積累，才能做出品質穩定的產品。希望老師盡快推出進階課程', '可以更清楚的理解原理，知道自己那裡出現問題。', '最近迷上作麵包，從網路上各式麵包youtube教學中學習，五花八門令人眼花瞭亂，常常只知其然，不知其所以然，所以失敗機會高且每次成品品質無法穩定，但看了火頭工師傅的課程後，他利用科學方法教我們做麵包，把一些原理原則講解得很清楚，有效降低失敗變數，再加上示範的手法有用一般版及現場師傅的快速版二種示範，也讓我仿彿置身麵包店觀看麵包師傅的現場操作，很有臨場感，很過癮。', '適合有些基礎的烘焙者\n對於過程如果有問題想急於得到幫助的人,可能要自行先上網先去尋求其他資源協助', '之前一直都是自己在書本上及網路上摸索如何做歐包，所以做出來的成品時好時壞，此次經過老師網路上示範與說明，對於做麵包，有了更深的體認，也增加自己做麵包的興趣，謝謝老師!', '火頭工老師謝謝你的教導，我從你的fb到你出書到開課程我ㄧ路跟隨你的科學麵包，學了很多做麵包知識，很期待未來還有高階課程能開課。謝謝你，很辛苦的準備資料傳授給我們', '真是太棒了、也因為這課程、烤出我對麵包的熱誠', '火頭龔老師的解說非常清楚,跟著老師的說明,在家真的能做出老師示範的麵包\n希望老師繼續開中級課程', '原本就有老師的書，有別於一些只有配方的書，感覺比較像是一本理論脈絡很清楚的""教科書""，受益良多，很好看!此次透過老師的課程講解，實際看到老師操作，解了一些過去做麵包的困惑，真的很棒!!', '以前，自己看譜做過一陣子麵包。偶爾，只是偶爾有過堪稱美觀可以食用的幾次經驗，所以後來就不敢嘗試做麵包！\n這次是老婆大人鼓勵我報名上課。雖然看得懂課程上老師說明，但是實際操作時卻發現有好多不明白、不清楚的細節！\n原來，魔鬼真的藏在細節裡！所以再重複閱讀、重複觀看課程內容，前後試著做兩三次之後真的功力大增，做出來的麵包不敢說美麗動人也是美麗大方可口！\n個人覺得一開始要融會貫通課程內容仍有些難度。除非多試著做幾次才有可能知道老師說明的真正意思是什麼！理解多些之後，現在做麵包真的得心應手許多！\n當然，整型手法還要多練習，要不然都是圓滾滾的麵包了！\n', '謝謝老師分享經驗。做烘培經驗的累積很重要，本已有了實務的經驗再看了影片，就如醍醐灌頂，有些小細節知道怎麼處理了。不用舟車勞累去上課，輕輕鬆鬆在家看影片，不清楚可反覆看。\n', '很多理論跟步驟都很仔細，非常用心。', '老師教授的內容淺顯易懂，只要照著老師的步驟做，幾乎可以做到七八分像。\n教授的麵包也都以以健康傳統為主軸，很棒的內容。', '對於新手幫助很大', '老師社區經營理念的講解，譹有心推廣的學生能增加信心。謝謝', '\n☆謝謝老師及團隊的用心製作，學到很棒的基礎 ^-^\n\n1. 影片募資期間，已留言想了解麵團""擴展階段""及""完成階段""，\n    很可惜課程只在布里歐非常輕描淡寫的帶過，無法有所收獲\n  ，如何拉膜(手沾水？)、膜破口狀態(鋸齒、圓滑)、打過頭液化\n   、為什麼有的要薄膜有的不用，都還是謎 (Q口Q)\n2. 有些理論想再多了解(不用很深入)\n     (a)吐司2分52秒有兩種方法：直接分割滾圓後發、靜置翻面\n     靜置分割。各自的優缺是？(如口感有差異，也許可以講解後\n     讓學員自己選)\n      ~~~~~~~~~~~~~~~~~~~~~~~~~~~~~~~~~~~\n     雜糧麵包提到「預發酵 前置發酵 中間發酵 跟後發酵到底差\n     異在哪裡」只有說明流程，無法了解對成品口感保溼度等實\n     際影響\n     (b)布里歐的可可粉先放與後放，老師只講各有優缺…想了解\n     大略的差異在哪？\n     (c)奶油和鹽可一起打，但小餐包的橄欖油和鹽卻要分開打？\n3. 枕頭型塑形，雜糧麵包：16分50秒「兩手大拇指放在中間折\n   痕，往內推，再往下壓」，如果「往下壓」有從老師往鏡頭\n   方向的視角解說動作，我會更清楚手勢\n4. 喜歡老師傳授兩種整型方式供學習→初學者、專業師傅\n5. 雜糧麵包和裸麥麵包都是用枕頭型，希望可以""錯開""，多示\n\u3000範別種形狀\n6. 麵包如有剖面氣孔照，可讓學員比較差異，會更棒~\n7. 老師微型社區烘焙店理念讓人很憧憬，這麼棒的共好社會真\n    希望能遍地開花', '以前用食譜製作不知道問題出在哪裡，看完一遍教學影後，可達專業等級。', '1.每個步驟及細節,都能深入淺出的講解,操作手法及學理都能加深印象喔!\n2.如果產品能再看到出爐冷却後麵包的剖面圖,會更棒喔!\n', '十分詳細內容扎實而且有疑問也可以再發文發問，', '首次嚐試線上學習,老師的帶領方式非常能夠理解\n操作後也能再回頭觀看非常受用\n唯獨沒有實品的切面可以參考\n無法比較自己到底做的好不好', '有些理論的東西想深入了解，課堂上沒有解釋很清楚，但另行翻閱才會比較更清楚。', '感謝老師把寶貴的實作經驗分享給我們,深入淺出的教學,讓我們更容易瞭解麵包的學理與技術,能做出天然無添加的健康美味麵包,真的很感動!', '有些地方可以更深入解說會更明白其原理', '照著老師詳細的解說提醒，第一次做出超級美味的雜糧麵包，好開心哪！', '由淺入深/鉅細靡遺，謝謝六星級的老師，但是學生自己也要再加把勁，繼續多練習，才會更進步', '以深入淺出的授課方式，用嚴謹方法分析每樣食材配比及製作流程，潛移默化成烘焙科學，\n物理是火頭工老師的專業，講究的是科學的根據，教導我們做出健康的麵包，這是手作烘焙的最高追求！', '內容非常詳細，而且操作很清楚，希望未來還有機會再開其他麵包課程。', '老師教學仔細課程內容豐富，講課節奏恰到好處。裡面的幾款麵包看起來美味可口，是一般市面少見的健康無添加麵包，黃澄澄渾圓飽滿的麵包隔著螢幕就覺得香，讓人上完課後忍不住想趕快交作業，順便大飽口福。', '自己做麵包都是從書本和網路中學習而來，參加這門課程讓我對酵母和麵粉的特性和用法能更進一步的了解，在老師詳細的講解示範下，操作技巧上也受益良多，期待老師的進階課程。', '老師的講解非常清楚，步驟也很詳細，有些細節老師在上課中都有說明，實作之後再回來看一次才有感覺，原來老師早說了。\n我覺得微型社區麵包店的經驗分享非常可貴，這是多年經驗的累積，我也很認同這樣的觀念，希望進階課程也有幸再聽老師分享。謝謝老師', '看影片的過程中，可以感覺到吳家麟師傅，對於麵包的熱情與專業，用溫暖平緩的語調，一步一步細心的教導我們，最後還有許多對於創業的建議，沒有過多的誇飾，非常實在實用的課程，感謝。', '我退休後開使跟麵粉談戀愛，熱愛烘焙的我，每天泡在麵糰中，常常也會找不出頭緒，五年的時間裡試了又試，感謝老師的深入淺出講解，最重要的是有一個平台幫忙解決問題，您的佛心可以造福很多人，期待您的進階課程！希望有機會可以參加實作課程。第三階段社區麵包坊理念更讚，我目前的分享模式完全相同，謝謝老師！', '老師說話慢條斯理，內容詳細，不懂之處提出問題，老師也能一一回覆，目前已作出了兩項作品，都很不錯，繼續努力中！\n師父引進門，修行靠自己，相信多練習，手法一定會更熟練，作品會更好！', '內容深入淺出。', '關於做麵包的罐唸老師說明的很仔細，但...希望講義上面能寫的更清楚ㄧ些！！例如：關於老面的做法...時間程序...到底是包括原本操做的那次還是再攪拌2次...所以總共是3次...希望能有更明確的標示！！', '有些細節的部份不夠明顯，就讓學習者有著疑惑的心繼續聽課下去，那也就讓學習者很容易分心。\n舉例而言\n小餐包的麥芽水，是什麼呢？\n我如果知道了，那我肯定不是初學者，既不是初學者來上這門課就又太浪費時間了，所以，我還是希望在細節上可以更清楚的交代一下，例如，麥芽水就是麥芽糖加水，比例都可以，只要事麥芽糖跟水即可，加這個的用意就是要風味更有層次.....，諸如此類的。\n還有第三單元的課程，我真的覺得沒有必要撰述，有點畫蛇添足的感覺，在我看來，我只是要學習一門烘培課程而已，不用去注意這些開店的理念.....等等。', '原本我做麵包都是從別人網路分享或書本的配方來學習，一直搞不清楚烘焙比例丶操作方式，這課程中老師的講解方式收獲良多。']"
