,課程名稱,評價星等,評論數,總影片時長,觀看數,價格,課程簡介,評論標題,評論內容
9,紙上的美妝師：連禾時尚彩妝畫,5.0,12,130,110,2600,"透過此堂彩妝技法課程，可針對初學者在設計真人彩妝及髮型與整體造型前，先以手繪設計圖方式來練習繪出其設計重點，能更加有效做為前置作業時的參考依據，打造出亮麗的設計表現。

對於無繪畫基礎者，透過使用設計底圖（線條稿底圖）模式來練習彩妝畫的繪畫與上色，跟隨著老師的教學步驟，也可以學習到手繪的技法，藉此來完成屬於你的彩妝畫。","['連禾線上課程', '課程很棒', '老師講解很仔細', '收穫滿滿', '很實用', '連禾線上彩妝教學-五顆星', '五顆星', '時尚彩妝畫', '彩妆畫線上學習～五顆星', '彩妝畫', '5顆星', '第二章第二單元']","['非常棒也非常清楚，頭髮流線及眼妝上色技巧！\n真的收益良多，謝謝老師教學', '老師很細心講解每一個過程，繪圖細膩。。讚', '對於美容紙圖很有幫助', '線上教學可以讓我們加深印象，在家也能跟著學習繪畫\n', '學到很實用的繪畫方式', '期待好久老師的線上教學終於開始了，老師真的好仔細的教學，0基礎也能完全上手。\n跟著老師的教學一步一步，對繪畫沒有天分的我，也樂在其中。', '線上上課對於我們工作忙碌的人來說，是開起學習方便之門，很開心能夠跟老師繼續學習💕深入淺出的畫法，讓我在學習上很快上手👍', '老師的畫就是這麼維妙維肖，不管是從以前跟老師學還是在線上看每次都依舊驚豔著我。這淺顯易懂的教學方式，相信就連0基礎的人，都能經由老師的一步步畫出屬於自己的畫作，得到成就感的。希望有一天我的繪畫也能像老師一樣到爐火純青的境界。很幸運可以認識老師!!!', '彩妆畫線上課 程返覆看了幾遍感觉很棒的課程，由基礎帶進，由淺講解漸進..無論色彩疊色、妝容、髪絲、眼睛的傳神表现..讓我感覺非常值得學習，仔細的講解讓人迫不及待想要畫了！很開心终於看到連禾老師開線上課程了，一直很欣賞連禾老师各項畫作，線上課程對平時忙祿沒時間現場上課的這線上課程真的太棒了！\n', '課程從妝到髮及半身的妝畫都非常的清楚說明，立馬要來練習，但找不到路徑下載，還有發現我還沒上課好久之前就有買老師的書了😁\n希望老師跟我說下載路徑，可跟著老師的課程練習', '   教學非常的仔細精彩，我是剛入門的學生，有時間我會多看幾遍，希望把老師教的都學起來，希望能很順利的繳交指定的作業，感謝這麼棒的學習平台，聘請這麼優秀的老師💕', '眼睛的素描好傳神，\n老師示範講解簡單易懂，👍']"
10,原型師模型課程：九天衡-邪羊莉莉,5.0,5,1163,286,2500,"透過這個課程學習的技術，會帶領學員做出一件完整的高階人物實體模型。除了講解女性臉部、身體比例、動態、肌肉的雕塑方法之外，還會分享怪獸頭骨、武器與翅膀的製作。
學到技術的學員除了製作自己的作品外，更可以運用在 3D 印製造型修補上，雕像修復，造型改造上，運用範圍廣泛。","['超值', '超讚的課程', '物超所值', '實在很棒', '好豐富']","['學了好多!!', '超讚的課程，內容多到爆，感謝老師。期待解鎖課程早日開放^_^', '手把手教導 ，細節講解很詳細', 'PKKING老師的教學鉅細靡遺，而且看老師做東西挺療癒的....課程時數份量非常夠，CP值超高，觀課後也覺得獲益良多，往後遇到製作瓶頸時一定會經常拿出來參考。', '超值']"
11,骨架和姿勢：三小時教你畫出日漫人物動作,4.73,11,199,374,1500,"🖌  抓住人體姿勢的繪畫重點
🖌  畫出生動的人體姿勢（素體，不包含衣服）
🖌  學習畫人物素體的練習方式

老師小提醒：畫人體姿勢是非常需要練習的繪畫基本功，只要常常觀察周遭的人物動作，多多練習，每個人都可以畫出充滿動感的人體姿態喔！","['簡單易懂 , 很適合初學者', '老師的方式很好上手希望往後可以多加應用', '簡單易懂，內容偏少', '入門好選擇', '適合開始接觸繪畫的新手', '初階入門', '新手也能自信的畫出姿勢', '對人體肢體描繪不擅長的新手很適合', '學完課程後可以很流暢地畫出簡化人體。', '簡單易懂', '適合新手的課']","['感到心態炸裂時 , 就會來稍稍看個影片並練習 ,\n簡單易懂的練習, 讓我有回歸基本練習的感覺 , \n每次都能讓我感到安心', '非常實用邊看邊學真的受益良多', '初階適合，但沒細講四肢的畫法', '簡單易懂收穫很多。', '覺得這門課應該被稱為動態描繪或人物速寫，因為主要在教如何快速描繪、找出人物姿態和強化角色動態，骨架和肌肉的討論不多，另外繪圖風格也不太像日式，而是更偏向歐美的風格。\n個人而言，老師的描述過於抽象，聽起來有點難以理解，但也不是說不好，對於完全沒有接觸的人，或是學習時會對大量專有用詞感到疑惑的人，這樣的教學模式也許不錯。\n不過老師對練習和學習心態的說明，對我來說是很好的學習，也許這些概念會對學習繪畫過程中感到倦怠和瓶頸的人有很大的幫助。\n整體而言，我覺得這門課適合開始接觸繪畫的新手或是當作將畫圖當作興趣的人', '算是很好的初階入門，但是沒有講到很深入', '內容好理解也有具體練習的方式，讓繪畫新手也能無壓力的畫出姿勢ᕦ(ò_óˇ)ᕤ', '課程學到很多，也給我很多參考，但多練習還是比較重要', '適合新手學習的課程。\n老師跟主持人在過程中會很輕鬆地回答畫圖時遇到的問題，\n學習這門課後，對於畫動作流暢自然的人體姿勢會更有自信。\n不過若是想要學習關於藝用解剖(人體的肌肉、骨骼)，這個課就不適合。', '內容多，但是挺簡單易懂，而且需要更多實作練習的課程。', '最近開始學電繪，想增進畫畫技巧卻不知道怎麼開始，老師透過自身經驗，分享人體速寫該怎麼練習，當中的心態如何調整，還有推薦很棒的網站練習速寫！上完了這堂課讓我更清楚明白需要加強的部分，以及練習的重點在哪😌更重要的是不要有壓力的畫畫～～']"
12,從生活小物到街景，用鋼筆速寫在日子裡旅行,4.86,37,88,685,1200,學習運用隨興的筆觸，以鋼筆速寫描繪周遭景物，只要隨身攜帶工具，隨時都有機會完成鋼筆速寫作品。,"['收穫滿滿', '鋼筆速寫', '很棒', 'not bad ', '很喜歡這堂課', '講解仔細', '很不錯的課程', '很好的課！', '示範', '很好的課！', '鋼筆繪畫初體驗', '超好！！很治愈的課程 慢節奏體驗生活的美好', '跟著老師一步步練習', '畫下去就對了', '棒棒', '沒有基礎也可以參與的課程', '多畫多練習', '講解很清楚', '老師很用心', '鋼筆的拿捏', '不錯的課程', '適合初學者 大推!!', '循序漸進，值得學習的課程~', '講解清楚', '推推', '課程內容豐富，由淺入深，大推', '講解示範簡單易懂', '優質好課', '輕易上手的課程', '很棒的課~', '輕鬆速寫', '很棒的速寫課', '復古風味色鉛筆速寫', '可以跟著老師一起畫很棒', '用鋼筆速寫在日子裡旅行', '完全沒有繪畫基礎的鋼筆速寫', '又學到了很有特色的速寫']","['謝謝老師的指導! 收穫滿滿, 要來好好練習了~ ^ ^', '沒有繪畫基礎也可以從簡單的工具來開始進行學習，老師的口條清晰，說明清楚。', '多練習真的會越來越進步，謝謝老師的細心講解', 'not bad but deem overpriced vs others in view of course duration', '很喜歡這堂課！老師輕聲細語的帶著你畫出有個性的速寫，一開始從模仿開始，先把影片暫停，畫出自己的構圖，再對照老師畫的構圖，觀察差別在哪裡，慢慢的後續自己畫的時候會一直想到老師說的：「不要想太多～放輕鬆～畫自己喜歡的線條就好」，這真的很重要，而且整個速寫的過程讓心情非常平靜\n第二個令我驚訝又感動的點是，原本想說這堂課開課這麼久了，老師不知道會不會回答我的疑問，結果老師也很有耐心、很清楚的點出自己的問題，我覺得很棒！！\n最後整理一下我認為這堂課的精華所在：\n1. 可以藉由模仿高手(老師)下筆的構圖、下筆位置、線條表現、陰影等等的\x08小技巧，需要自己拿出紙筆跟著老師練習！\n2. 有基礎的透視概念，新手畫可能會像我一樣東西歪歪的飄飄的，但不至於畫不出來物體，對於可以畫出場景、物體的我已經覺得很驚訝XD\n3. 速寫過程很舒壓、心情放鬆', '影片講解仔細,適合初學,很喜歡~~', '第一次接觸速寫，也是第一次接觸鋼筆，有點不知所措。發現自己會畫成素描，一點都不「速」。慢慢從小物練習，還是會忍不住想用鉛筆先打稿，後來慢慢跳脫限制，感受速寫的樂趣。雖然現在還是畫得很慢，但最重要的應該是透過很多的練習才會進步。謝謝老師深入淺出的帶畫。', '老師很詳細的講解，很棒！', '老師講課內容所提重點簡約明暸.另建議多些下筆,筆觸方面的示範.', '老師很詳細的講解', '這門課程從簡單的用具介紹、描繪身邊小物到戶外大景都有很精要的講解和示範，而且老師都會給每個作品做出用心的回饋。\n這是一個很棒的繪畫體驗~第一次發現用鋼筆速畫也可以這麼美!', '我想不到什麼比較高級的形容詞了  反正就是超好！！老師也很溫柔！！', '從小物件開始到場景速寫，老師都有詳細的示範，可以跟著老師一筆一畫完成畫作，很有成就感。', '從身邊小物著手,訓練觀察力,就是要勇敢的畫下去,沒有對錯,沒有好不好,每個人有每個人的特色.', '棒棒', '老師的語調很悠閒，也一再強調沒有絕對的繪畫方式，初學者感覺比較沒有壓力。', '多畫多練習,其實沒什麼叫畫的好看和畫得不好看,畫出來即使歪歪斜斜也具個人特色', '喜歡這堂課～', '讓我重新拾起紙筆去享受畫畫的美好，也意外獲得了許多讚賞！', '對於繪圖的概念有詳細的概念解說\n鋼筆運轉的方式也希望老師可以多多在說明\n整體課程會希望馬上拿筆就起來作畫了～', '內容由淺入深，適合初學者，上課後會想立即拿起筆開始畫：） ', '我是個初學者，跟著老師的步驟慢慢練習畫出自己的風格，\n課程內容清楚易懂、由淺至深，內容豐富，\n另外課後練習的作業回饋更是用心指導與示範，鼓勵學生不斷嘗試!\n我很喜歡這堂課~', '課程循序漸進，有步驟地從小物件，室內空間到戶外景象推進~\n老師講解仔細，聲音很溫柔\n課程中有不懂的地方只要發問，老師都會很仔細地說明\n也會針對作業給予建議和鼓勵\n是值得學習的好課程!', '課程由淺入深，容易明白', '很舒服就上完一堂知識量滿滿的課。', '老師從鋼筆的挑選與保養，先畫小物，再畫室內空間，再進一步到街景，由淺入深，內容豐富，我覺得收獲很多，很推薦對畫畫有興趣的人一起來上課喲。', '從簡單的小物到空間的透視，老師的講解和示範簡單易懂，讓我能快速理解。一些小地方的畫龍點睛小撇步更是讓作品感覺更靈活。', '講解清楚，受益良多', '從剛開始根本不會畫畫，怎麼畫都沒畫面感，透過課程跟著老師的步驟慢慢勾勒出一個畫面，雖然還不到自己滿意的狀態，但比還未上這門課進步很多!!!', '其實平常就有畫圖的習慣，但想看其他人的作畫（速寫）過程，還有用具，所以上這個課。\n上課後對於速寫又重新燃起熱情~幾乎天天都會畫圖XD\n之後會嘗試常常出去寫生~', '不用考慮太多限制的輕鬆速寫，跟著老師的節奏也能輕鬆畫出一幅小品圖。', '跟著老師的步驟練習，希望之後也能畫出自己的風格', '課程內容符合需求', '收穫良多，老師的示範很清楚，每個單元最後還有會要點總結，對我來說用影片學習速寫比單看書本學習來的有動力，動態的影像讓我可以看過一遍後再試著自己畫一次，開啟速寫的第一步。\n只是有部分示範旁邊沒有原本的圖片對照有些可惜，還有後面街景的部分，畫面稍快，其他部分都不錯，只需要克服拿比起來畫的障礙就可以了。', '內容清楚清晰 多練習可學到很多', '本來很擔心完全沒有繪畫基礎會很悲劇\n但就像老師說的 下筆不要想太多 多觀察 多練習\n所以我就以不管有沒有bug的心態開心畫\n沒想到丟給朋友看 評價還不會太差\n當然回頭仔細審視自己的作業 會發現很多缺點\n但相信多觀察多練習就會進步\n謝謝老師', '最近上了不同的速寫老師的課程,發現這堂課可以用看輕鬆的心情來畫出更有自己特色的記錄生活的作品。很適合初學者輕鬆畫,會愛上速寫哦!']"
13,藝用解剖學 1 - 達文西維特魯威人,4.93,27,884,1035,2800,一張精準的達文西維特魯威人畫像，和全身正面骨骼肌肉的知識。,"['絕對經典！', '藝用解剖學 ', '收穫滿滿', '對人體構造有更深的了解', '收穫滿滿的課程', '課程詳細，內容有趣', '具體測量，比例掌握', '很客觀的教學.非常有收穫', '繪畫課程', '可以學到很多東西，技法是當然，在故事上的分享會讓人更好記憶各身體部位', '很好的老師', '課程內容豐富且仔細', '非常詳盡', '大家快來修課', '看了第一節了，感覺老師很用心。', '清楚入門好課程', '有趣到停不下來', '教學紮實', '超棒～', '藝用解剖學', '藝用解剖學', '覺得獲益良多', '實用', '很棒', '好棒的課程！', '內容詳細,還有故事聽^^', '適合完全不懂解剖(或穿察力弱)的人來看']","['維特魯威人作為文藝復興人智啟蒙的藝術的藝術作品，再沒有比這個更適合的\n老師裡面漫談歐洲藝術史的發展也實在是頗富趣味\n雖然已經是好幾年以前的課程了，然個人仍然私心希望，\n能夠追加各種不同角度：側視、俯視、仰視的解剖教學\n還有\n孫子兵法的作者是孫武不是孫髕\n原始人就原始人，還摩登原始人......\n要是有女人要我等她兩小時，早就分了', '課程內容收穫滿滿\n老師很詳細一步一步帶著同學了解人的骨骼、肌肉的描繪方式，\n除了很清楚的說明各個部位的名稱和比例，\n在繪畫過程中，\n老師也會分享很多故事，\n讓解剖學多了趣味和印象，\n也有提到給予學習過程中的建議，\n很棒的課程。\n會讓自己想多看幾遍好好學起來~', '謝謝老師詳細的教導與有趣的解釋', '感謝老師開這門難度超高的課程，雖然難度高，但跟著老師步驟畫，很容易上手，許多骨骼和肌肉的專有名詞，還需要多了解及像老師說的多念幾次，才容易記住，完成維特魯威人很有成就感，謝謝老師！', '非常喜歡老師有條理的教學，照著老師精準的比例去完成骨骼、肌肉、至維特魯維人完全不是問題。老師口條清晰，時不時會補充藝術史、畫作相關的知識，讓課程豐富且收穫滿滿。期待老師再開更多相關課程:D', '邊跟著老師畫的途中邊聽著一些有趣的故事。\n意外的也獲得了很多冷知識XD?', '在課程中，能跟著老師的腳步用具體的數學長度掌握人體各部位比例，對於我這個醫學相關科系的學生記憶骨骼與肌肉位置有著幫助，值得修習的一堂課', '老師太強了!! 深刻明白老師所說台下10年功的努力', '老師教學非常詳細，時常補充可能遇到的問題，並分享相關的知識，非常值得一上！', '老師給人的感覺非常好，口條清晰，重點都有說到。一步一步帶你畫到最後，該注意的細節都非常仔細教學，複雜的人體被拆解成一塊一塊的積木般，你只需要記得這些技巧就能構築出一個人體，我覺得非常的棒，會感覺自己進步很多，謝謝老師的耐心教學。', '很好的老師\n重點都有帶到.\n而且上課十分有趣不會讓你想睡覺也不會頭痛.\n(有些老師口條不好...上課看到很頭痛.)\n(老師說的故事都很有趣).\n只是希望老師可以在開更多課程...我一定買!!', '說明非常仔細，老師技術純熟，知識豐富。跟著老師的教學步驟一步一步來，真的能畫得出來。謝謝！', '扎實的用比例尺精準地完成作品的方式非常厲害\n除了詳細，能在課堂上聽一些故事也很棒，很適合工作的時候一邊聽。', '老師將骨骼與肌肉的關鍵點與比例都講解的十分清楚且詳細，也提點了許多繪製技術的部份，學習到很多相關知識!\n而且一邊上課還可以聽老師講許多關於骨骼與肌肉的故事、希臘神話和生活趣事~\n總之是一門很棒的課!', '看了第一節了，感覺老師很用心。', '謝謝分享。', '非常有趣，值得學習', '解釋很細，提供規格比例這點很棒', '課程非常實用～', '實用', '非常實用', '覺得老師教得很仔細，從骨骼比例到肌肉生長的位置都解釋得很詳盡，看完之後真的有學到東西。在網路上學習的好處就是可以停格下來自己仔細觀察，對於在大班制教學上課時非常容易跟不上的我來說幫助很大，謝謝老師在網路平台上教授這門課。', '非常實用', '老師教得很仔細，故事也蠻有趣的～但只有正面是有點可惜，期待接下來的課程。', '非常實用^^', '內容詳細豐富,還有相關故事聽^^分享學習經驗也很有幫助\n時數多價格便宜...還蠻物超所值的\n不過因為老師畫的時候放大的畫面跳來跳去...有時會看不清楚細節和整體關係\n在考慮想把講義圖印出來看會不要有幫助...找時間嘗試', '對繪畫外行，但很想學。之前翻了許多解剖書，總是無法順利理解，這堂課十分清楚。肌肉起點、位置、骨骼名字都跟你說了。\n一筆一畫從頭帶你走，不會有無從下手的問題。觀察力弱的人聽老師用格數講解，很清楚各部位的長度與大小。\n這堂課只教正面只差沒有3D模型幫忙。沒提到的部分:透視、人物角度、(人物上沒有女生跟種族差異)外真的十分扎實。\n非常感謝老師。']"
