,課程名稱,評價星等,評論數,總影片時長,觀看數,價格,課程簡介,評論標題,評論內容
0,怪獸工場 - 基礎素描實戰篇,5.0,53,657,1553,3600,"提升素描的基礎實力，獨立可創作出靜物素描、風景素描、石膏素描。
廣義的來談，可以應用到各個美術領域做沿伸基底。","['內容豐富', '很實用的繪畫知識', '不錯', '收穫滿滿的課程', '好讚讚', '乾貨滿滿！！！', '內容量真的多', '收穫很多', '老師很用心', '👍', '紮實的基本功教學，CP值超級高', '非常深入的教學', '想成為現代藝術家不可錯過的經典必修課', '內容非常多 要慢慢消化', '老師非常有耐心....', '很實用的課程', '很棒的課程', '非常值得', '有收穫，值得', '改作業非常用心!', '內容豐富的課程', '內容十分實用，老師批改也十分用心', '扎實實用性高', '受用無窮的課程', 'a!', '實用的課程', '講解豐富', '实用1000%', '是個乾貨很多的課程', '好課推薦', '清晰易懂', '很實用的課程', '讚ㄛ', '一目了然', '好', '用心好課', '用心的課程', '實用的課程', '很實用的課程', '非常實用!', 'CP質高的課程', '感謝老師', '課程內容詳細', '一個能讓你學會畫出任何東西的課程', '物超所值', '大推~', '好課推薦', '基礎觀念大大提升', '怪獸系列-必修課', 'CP值高！', '物超所值', '讚！', '非常厲害的課程！！']","['課程買很久，都是一點一點慢慢補完，老師講的很全面，\n對於剛接觸電繪不久的我幫助很大！\n非常推薦購買！\n', '這堂課讓我學到了很多繪畫相關的知識，能夠將原先鬆散的繪畫流程進行邏輯性的歸納，這對於一路蠻幹過來的我是非常有幫助的!謝謝老師帶給我們寶貴的經驗及知識。接下來就像課堂所說，我會持續練習並且溫習課堂上所學的思維與技法。也祝福其他同學同樣有滿滿的收穫。', '講解仔細，很不錯', '我覺得上完這堂課對於素描的練習方向有更明確的掌握 這堂課比較注重在觀念上的引導 練習的時候比較清楚自己在做什麼 知道要在哪方面加強（不知道哪裡可以加強可以請教老師）另外就像老師強調的 真的要多練習才會進步 雖然完課了但之後一定會常常回來複習 補足第一次看遺漏的細節 還有努力交作業 是值得回味的好課程！謝謝老師', '收穫非常多的一門課!!!!\n購買前價格雖讓我退縮但上完覺得非常划啊!!!!\n內容滿滿外老師教學的非常細心且用心\n令初學者的我好像也會了些皮毛了!!', '真的可以說是乾貨滿滿的課程，這樣用心的課程，以及傾囊相授的教學，真是十分難得。因此我決定購入全部怪獸工坊的課程，進一步提升自己的畫技與觀念。♥️！', '這是個好課程      如果是畫到瓶頸的人    真的推薦       ', '有些觀念雖然聽過，但根基打得不紮實，常常不知道問題在哪。經過這次課程感覺很多問題都通了。', '我其實是完全菜鳥，\n對於老師一步步用心的分單位教導\n給予很多很多知識與認知的架構。\n但我還是需要老師說的大量練習才有辦法達到老師說的～同學應該要有這個能力😂\n因為在大形的構圖就要有基本的架構。\n對於構圖的等分對比要如何抓取也是要透過不斷的微型縮圖的模式再去放大整體。\n謝謝老師很用心在教導。\n', '獲益良多', '課程售價乍看之下有點貴，可是滿滿10小時的內容含金量超級高。\n10小時是濃縮精華，若換算成實體課程，可能是一學期或是一年的內容。\n這堂課的基礎內容，對於非本科系或是沒有受過系統教育的人來說，是超扎實的基礎練習，課程所學不管是學電繪或是傳統素描都受用十足（親身感受）\n\n另外老師的批改既仔細又快速，不厭其煩又非常針對個人，不是回覆留言隨便敷衍而已，只要你肯畫老師都不怕改，光這點我覺得就超過這堂課的價錢了。\n\n價值超過定價，非常非常推薦給新手練功用！', '深入且有系統性的教學\n不會過於雜亂讓人難以理解', '非常感謝藍老師無私的分享!課程中老師帶領我們從""安德魯‧路米斯-畫家之眼""12項基礎美感的認識，素描的基礎三大面、五大調全方位解析，藝術家在創作過程中是透過不斷地去思考，如何解決問題，如何再提升自己的審美。而優秀的創作不只是如實呈現、畫的像而已，而是融入自己的轉化跟想法。藍老師深厚的傳統底子+現代電繪的完美融合，超棒，這是一堂一輩子都不能錯過的精彩課程!', '謝謝老師不藏私的分享', '因為沒基礎，光第一個單元就問了非常多問題，問到我開始覺得有點不好意思，但老師每次都非常有耐心的為我解惑，附上的批改作業檔案內的講解也都非常詳細QQ感動。', '課程內容紮實，老師講解詳細，上完課後收穫滿滿。', '斷斷續續抽時間慢慢看完\n課程內容不錯!\n也有學到新東西~', '非常好的課程', '繪畫的基礎真的很重要，\n是入門的必上課程。', '作業的批改會根據學生程度不同而給出非常客製化的建議', '課程內容豐富,且有各類繪畫主題之示範和重點提示等等,收獲滿滿。', '內容偏向訓練美感，觀感上的資訊，也有縮時展示過程，\n重要的是在批改作業時，老師十分細心，會很清楚標註，發現到很多自己較難發現的錯～', '推薦中低階的朋友們可以上課,可以得到一些技巧上的幫助', '課程內容非常的紮實而且清晰易懂，不管是內容安排或是作業批改都能感受到老師滿滿的用心，即使完課後也非常適合反覆觀看及練習來鞏固基礎、內化觀念，來讓自己往後的創作更加強大，唯一覺得可惜的是沒有早點來上XD', '讚啦 哪次不讚', '對新手很有幫助的內容，很棒的教程', '觀念講解多，細節結部分也有講解到', '完整的素描课，上完后比想象中获益不少。', '所有章節都有著連貫性，也讓我的繪畫理解多了不少，也解決了以前迷惑許久的問題，看完一次或許無法全部吸收，需反覆複習', '豐富實用的內容，也要持續練習', '將觀念講得很清楚，也有實作練習，幫助很大><', '收穫最多的是如何去做各方面的練習，用練習改善自身的弱項，和一直強調的正確觀念。整堂課每個重點都會實際示範完整的電繪素描過程，讓學生更有信心去實作練習。是很實用的課程，現在依然在不斷練習中，謝謝!', '直接給5星', '老師講的內容非常系統，而且詳細，循序漸進，讓我知道了CG繪畫的流程與學習的方向，過後交作業嘍。', '有範例可供練習很不錯', '老師超用心的教學，有講解、有示範\n充分說明電腦繪圖素描的完整過程，值得學習的一堂課', '許多自己摸索時遇到的困惑都得到解答，跟著練習，技巧也有所提升', '可以透過老師的解說 示範 掌握其重點', '要學習的地方很多，對素描的幫助很大', '養分很高~對插畫非常有幫助', '講解仔細，示範完整，釐清了一些以往關於素描的問題，且老師批改作業相當用心且快速，是一門CP質高的課程。', '非常物超所值，很多沒有補充到的觀念，受益良多', '課程內容詳細，收穫良多，感謝老師。', '從結構到光影，從實體到虛體，老師全部都在這個課程裡教會你，是一堂不能錯過的素描實戰課程。', '老師講解的很仔細，讓我可以打好繪畫的基礎\n在繪畫上遇到問題都可以回到課程找解法，真的很棒!!\n\n', '收穫很多,讓我釐清不少繪畫的基本觀念,\n每個單元感覺是分開的,但其實一層一層的深入繪畫觀念,從單一物件帶到整幅圖,\n每單元的示範圖都有縮時攝影超棒的,可以很清楚看到繪畫流程,老師還會邊講解~物超所值', '詳細，內容豐富', '對於基礎觀念有很大的提升，讓自己的繪畫流程更加明確。', '物超所值，看完課程後，\n做練習，比過去上升了5-6個檔次，\n1年都沒突破的點，輕而易舉突破了...有種 這是我畫的嗎?\n這次的課 我稱為 怪獸工場的奇妙冒險....', '雖然內容多元，不過確實都是從老師觀念流程整合出發的。\n從觀念出發搭配老師細節經驗，讓課程十分豐富。', '很值得!', '老師講解的好詳細哦！', 'Blue老師的課程真的非常厲害！！非常用心的了解畫畫到中段，空練基礎，卻不知如何應用時會面臨的許多問題；這堂課尤為驚豔，幾乎我所有目前碰到的瓶頸和問題都能被解決。而且這堂課最重要的是老師在這裡還教導了怎麼完成一幅作品，還有構成一幅作品的許多要件，真的是物超所值！']"
1,藝用解剖學 2 - 凝望透視之眼 360 度全視野攻略,5.0,10,1068,322,2800,"掌握課程內容，能具備描繪全視角眼睛的能力。

同時，教學方式有明確的步驟和比例數據，以理性左腦的思維方式展開，不強調藝術家神來一筆的手感直覺，相信能讓修課同學以不同的角度認識繪畫、進而替自己擬定新的、有效的學畫計畫。

","['對眼睛的構造更了解了', '老師超強一定要買', '期待解鎖課程', '推薦', '神賜予的恩典！！', '非常喜歡藝用解剖學的課程', '視覺聽覺都超滿足！手腦也不停！', '課程內容專業充實、畫質清晰美感高', '真的畫出像樣的眼睛了！', '老師比學生還認真']","['之前畫人像眼睛總是畫不好,眼神不到位,上完老師的課,對眼睛的構造更了解了,謝謝老師這麼詳細的說明及示範,同步和老師一起畫的過程還可聽老師講故事般地帶我進入西方藝術史,真的很棒!!!', '這個老師的課程非常紮實，內容豐富，價格實在太划算，是我在hahow上面最推薦的老師，也是我覺得網站上面最值得購買的課程。\n就連畫畫的時候都會一邊講相關知識，而不是安靜的看他畫完。老師的兩堂課我都有買，雖然我看的很慢，但如果以後有出其他部位的課程我還是會支持!', '好棒的藝用解剖學，期待老師的解鎖課程 ^^', '雖然課程需要的練習很多，需要有點毅力\n但只要照著老師的步調一點一滴完成後\n就非常有成就感', '眼睛是靈魂之窗，我真心感恩HaHow請到大師級導師教導我最受用的解剖人體與深層的靈性之旅！！', '老師的每一堂藝用解剖學課程都有支持，也購買了老師最新的新書-骨骼之書，希望老師未來還能開設更多不同的解剖學的課程，因為實在太喜歡了!跟著老師手把手一步步地完成，完成後讓人充滿成就感也能感受到內心的平靜與充實!', '鉅細靡遺的講解跟示範，加上重複練習與提醒，腦中的資料庫真的越來越豐富了！\n最喜歡邊畫邊聽故事~尤其希臘故事！超級不無聊~', '這些天學下來，感覺眼睛畫不好是因為不了解眼睛的內部結構，所以才會造成眼睛的外型畫不準確。課程會逐一講解眼睛由內而外的結構，而且感覺的出來老師很用心準備課程內容，連影片畫質都非常清晰，畫面都美美的，課上起來心情就很好～看了還會想再看一遍，跟著老師一天一天慢慢累積眼睛的解剖學，加強記憶。', '我從小不是科班生，但是非常喜歡畫畫。每次畫畫時，畫到到眼睛，總是讓我很頭痛，每次都只畫兩個小黑點。\n\n不得不說，鍾老師的課程，非常有系統，自從參加課程後，眼睛不再是兩顆小黑點。因為老師的課程，真的設計很用心，從眼睛的結構分析，到如何描繪眼睛的神情，然後還有教東方人、西方人眼睛的差異，可以說是全方位破解眼睛，最全的課程了！\n\n除了畫眼睛之外，老師在課堂上，也會分享有趣的醫學史、藝術史、神話的故事。我之後一有時間，就會再回看這個課程，提升畫畫技巧，也順便增廣見聞。非常感謝鍾老師，以及團隊能夠推出這個課程！', '原本覺得課程時數還蠻長的，但是跟著老師一筆一筆練習畫，時間過的超快，有時候都快跟不上老師畫的速度！\n佩服老師還要一邊講解那些數字跟分享小故事。\n目前畫完每一小單元都蠻有成就感的！']"
2,一張速寫，一個生活故事,4.96,51,93,583,500,以完整的速寫概念開始進行隨時手繪的活動，像是一個走動的藝廊，翻開每一頁都是屬於你的藝術人生。,"['解說及示範都清楚，滿有收穫。', '值得上的一堂課', '感動！謝謝！', '淺顯易懂', '值得推薦的課程', '平實而豐富的課程~~', '把速寫帶入生活', '簡單易上手的教學方式，非常好的課程', '對於畫畫初心者非常實用', '簡單易上手的教學方式,非常棒的課程', '速寫淡彩', '淺顯易懂', '很用心的課程', '很詳細', '講解詳細', '老師分享速寫方式,說明的很詳細。', '不錯的課程，可惜的鏡頭', '很實用的速寫技巧', '很棒的課程', '迫不及待想動手畫', '適合新手的課程', '適合新手入門', '4顆星', '速寫技巧清楚簡單', '豐富內容', '非常適合新手的一門課', '很棒的課程', '很棒的課程超值得推薦！', '我敢畫了', '很讚', '很棒', '謝謝', '很棒', '課程平實近人', '課程紮實好用', '最喜歡老師在第2第三單元的用具解說', 'good', '上完課愛上速寫', '好課程適合初學者', '樂齡', '很實用的課程', '清楚仔細', '物超所值的一門課', '感谢！', '生活與藝術結合', '很精彩的內容  很親切的解說', '回歸初心,拾筆而畫', '棒👍', '很喜歡', 'Like', '詳細的解說示範']","['老師解說及示範很清楚，我最有收穫的是對於畫人臉部的講解，讓我明白不同角度眼睛的畫法不同。', '老師清楚解說，也會給我們的作業回饋，期待下一堂課', '謝謝老師的教學說明清楚作品感動', '上完課會迫不及待想自己畫畫看', '老師對於速寫很詳細，尤其關於寫人物五官的速寫，對不熟悉人物速寫的新手都很實用，老師聲音很動聽，加上每個主題示範也容易理解。很棒的課程，也謝謝老師鼓勵！會繼續多練習速寫。', '老師講課的風格平實而親切, 像個朋友般娓娓道來速寫的know-how和經驗談, 內容非常豐富實用, 對於想嘗試速寫的同學很有幫助~~', '速寫日常生活周遭，也是訓練自己活在當下，用心觀察，不錯的課程', '體驗完課程後，會想對於速寫有更深入的參考和了解。 ', '體驗完課程後，會想對於速寫有更深入的參考和了解。\n期待老師再開深入課程🥰🥰🥰', '上完課會令人有信心且急著動筆', '老師講解的不錯\n更進階的了解速寫 紀錄生活', '內容淺顯易懂。', '老師介紹講解詳細且簡顯易懂，對不知如何入門者很有幫助。', '課程內容由簡入繁，老師上課速度剛好而且很有條理。\n', '每個單元都有單獨附上老師的話', '老師分享速寫方式,說明的很詳細。', '課程一開始為各式畫畫工具介紹，有筆、顏料、素描本如何選用，可惜沒有逐筆畫出各式筆呈現的效果，對沒接觸過各式畫筆的人來說會不了解畫出的效果在哪。從生活周遭小物開始畫畫到風景、人物、場景，像是大綱介紹一些該注意的重點，覺得意猶未盡，會很想拿筆起來臨摹。鏡頭對焦跟不上老師講解的畫面，這邊要扣分。生活小物示範從樹葉開始畫，但上底色部份卻被剪掉，是教新手的課程，但重要的水彩調色和上底色卻被剪掉，是扣分的主因。\n整理而言，是很不錯的課程，有學到許多觀念和一些速寫手法。', '老師很仔細的示範了人、景物的畫法，尤其是人的五官在各種角度的畫法，而且一直跟我們強調錯筆沒關係，鼓勵我們多嘗試調色，帶出自己的風格，這樣輕鬆、自然舒服的速寫課程正是我需要的！', '老師的聲音很清脆，一聽就覺得很放鬆～\n說明的很詳細。', '上完課程會迫不及待想自己嘗試看看\n老師教的很詳細', '很適合新手上課，講解仔細，很棒~', '老師解說和示範非常詳細，很適合新手入門。謝謝！', '老師說明很清楚，只是字體擋住畫面，跟本看不到，四顆星是跟老師的，扣一顆星是給畫面品質', '簡單的入門技術,接下來就是要好好練習', '認真、用心又豐富的內容，讓我對速寫有更多的認識！', '上完這門課讓我對速寫更有概念，也有信心畫第一張圖了', '很清楚~老師說的很淺顯易懂', '很棒的課程超值得推薦！', '輕巧教學，初學者容易上手，我敢畫了，謝謝老師', '講解清楚明白,容易動手自己畫', '對於初入門.介紹非常清楚', '超讚課程，受益良多', '講解清楚明白,容易動手自己畫', '老師講解很清楚，新手可以很容易按照老師的教學進入狀況，老師分享的個人繪畫習慣（技巧）讓自己在速寫時覺得很實用，下筆時會更有信心。', '老師在短短的時間內，放入了非常多的實用的知識與技巧。\n\n在講義說明內，也添加了不少技巧的說明、與繪圖工具、繪製效果的比較。\n\n是一門非常超值的課程。', '還有非常實用的注意事項。', '講解都很實用也清楚', '原本為了面試來學速寫沒想到老師這麼細心教導竟然愛上速寫，以速寫紀錄生活是一件很快速卻也很細緻、有趣的事！！！', '老師非常清晰的講解課程，我非常喜歡', '很棒的初體驗 老師講解得非常清楚', '最近因為對速寫有興趣，因此報名了速寫課程。看完了之後覺得相當的實用，會讓人想要動筆試試看！', '老師的講課很清楚易明，對我來說最有用的是學習到透視及在不同位置望去的人物眼睛、口鼻畫法。謝謝老師！', '老師講話速度偏快但很清楚、很有條理、沒有冗言，所以92分鐘的課程裡能放入非常豐富的內容，課程費用也很親民，感覺物超所值。不論是老師上課的講解或課程的講義，都很仔細，謝謝老師的用心。', '老师一堂课很有步骤地带入了绘画的基本知识和要领，非常感谢。', '想學著留意生活中的小事物，畫下它們，增加點色彩。第一步還有點難，不過慢慢來吧，希望藉以增加生活中更多樂趣及自信。', '學了幾堂課的基礎素描之後  看到速寫畫家的作品  想學又摸不到頭緒 .   "" 一張速寫, 一個生活故事 ""  正好是有秩序的建立速寫概念的一堂課 .  Hahow  這教學平台很活潑. 鐘老師教學非常認真  解說很清楚  很有耐心 .   對作業的講評很具啟發性也很有鼓舞作用 .   謝謝 !', '曾幾何時,現在的人沒事時只能刷手機, 平板上網,這樣3C綁住的生活,真是無趣極了,現在透過 簡單筆紙顏色就能輕易記錄生活映像,這課程對我這種算是小入門,  對人物表情畫法我覺得最實用,  也看得出老師觀察入微, 頗有心得,期待老師有進階的畫法教學!', '介紹得很詳細👍👍👍很棒很喜歡❤', '想學習速寫，就是想紀錄生活的點滴，老師從工具的介紹到人物，風景…都引領方式讓從未學過的，可以循序漸進…\n  內容豐富又詳細還有講義提點重點，忘記了還可以再看影片不斷複習。', '讚', '第一次使用線上課程學習，老師的解說示範非常詳細，而且還能不斷重複觀看，不怕忘記只怕不動手，謝謝老師提供這樣優質的學習平台。']"
3,掌握產品素描 - ID Sketch（入門）,4.37,27,86,346,300,即時的產品發想Sketch，能有效快速的表達想法。,"['掌握產品素描 - ID Sketch（入門）', '非設計科系也能聽懂並操作的課程!', '學習繪製三視圖的技巧', '很棒', 'ok ', '鏡頭跳來跳去看不懂', '很不錯', '較適合產品描繪學習', '全部學完之後', '還不錯', '很棒，收穫滿滿的一門課', '內容淺顯易懂', '教法很好~~', '多練習', '攝影方式及口條', '適合初學者', '很棒的課程', '適合入門', '講解清晰', '掌握產品素描 - ID Sketch（入門）', '簡單明瞭初學必上', '很棒的課程', '概念講解清楚', '很棒的課程', '很棒的課程！', '講解畫面', '淺顯易懂']","['上課後會比較有概念\n只是課程螢幕畫面會跳來跳去\n雖然不同角度的畫面可以讓各角度有看到\n可是視覺上還是會有些不太舒服 ', '從以前就覺得手會很厲害\n但模仿網路上的圖畫出來還是差強人意\n經過老師的講解對於產品的畫法較有系統的認識\n是很好玩的一門課!\n', '示範許多製圖上的技巧，還有更有效率的做產品發想圖像化，讓製造端能看得懂的表示技巧。\n老師很認真提供問題答覆；多用這方法練習可以看到進步！', '很詳細', '還好', '感覺老師講解的很急切很趕，而且鏡頭畫面為什麼一直移來移去？\n如果沒有點透視基礎其實根本完全無法看懂。', '透視觀念說明的非常清楚很容易就懂了\n學到了一些新觀念\n', '老師很用心教學，只是有些角度看不太清楚，等待示範的時間較多，如果這時間可以多放一些技巧說明就更好了，比較適合運用在產品描繪上', '對產品的立體圖有基本的概念跟想法\n還在練習各種幾何圖形的運用及控制\n常常都是手畫的跟腦海裡想像的不一樣...', '這堂課是適合初階者的入門課程,對於有基本工設表現技法的同學來說,可能會有點小失望,不過最後材質設定和上色不錯,若有進階課,類似產品造型發想方面的sketch技法的話,會想上', '老師講解得非常仔細，課程很十分精采！是非常好入門的一門課！', '對於有繪圖基礎的人而言是很好的輔助教材。', '畫法重點出來真的很清楚，專心看老師怎麼畫，透視圖很容易理解 。\n希望老師能推出進階版課程~~謝謝老師教課~~~', '多練習', '攝影方式不流暢不清晰，口條過於緊張。', '本課程除了很適合初學者,課程中使用其他課程很少用到的麥克筆,所以可多學習一種繪畫工具。', '課程很適合剛入門產品設計系的人 受益良多 感謝老師~', '適合入門，但內容太短', '如果可以教深入一些會更好', '很不錯的課程，由淺入深的作講解，能給初學者(產品素描 )一個不錯的入門介紹，值得學習。', '簡單的教學～讓我很快進入狀況！', '內容簡要，講解清楚~~', '能把概念講解清楚，更能夠了解sketch的畫法!!', '很棒的課程值得推薦！', '透過老師的講解觀念變得更清楚容易學習！', '關於在示範的畫面，在時間點上似乎都沒有連貫，尤其是在從上而下的畫面與側面拍攝的畫面，此外建議，既然是圖面示範的課程，應該就完全從上而下來拍攝，有一些重點畫面更可以ZOOM IN，強調畫時的細節。', '以簡單的方式學會產品繪製\n老師在課程還講了一個很好表現凹凸曲面的分模線，在呈現這面的時候真的很好用\n分模線是我覺得對我幫助最大的部分']"
